data,language
पोषण कॅल्क्युलेटर कसे वापरावे?,mr
एबीएचए (आरोग्य आयडी) याचा वापर हे तुमच्यासाठी आणि तुमच्या कुटुंबासाठी सुरक्षित आणि कार्यक्षम डिजिटल आरोग्य नोंदी तयार करण्याच्या दिशेने पहिले पाऊल आहे.,mr
"हे सहभागी आरोग्य सेवा प्रदात्यांशी तुमचं एकमेकांशी असलेले संभाषण सक्षम करते आणि तुम्हाला तुमचे डिजिटल लॅब रिपोर्ट्स, प्रिस्क्रिप्शन आणि निदान सत्यापित आरोग्यसेवा व्यावसायिक आणि आरोग्य सेवा प्रदात्यांकडून अखंडपणे प्राप्त करण्यास अनुमती देते.",mr
"मुले, किशोरवयीन मुले, गर्भवती महिला आणि स्तनपान करणार्‍या मातांना तंत्रज्ञानाचा लाभ देऊन, लक्ष्यित दृष्टिकोन आणि अभिसरण देऊन पौष्टिक परिणाम सुधारण्यासाठी पोषण अभियान हा भारताचा प्रमुख कार्यक्रम आहे.",mr
पोषण ट्रॅकर लॉन्च करण्याचा हेतू काय आहे ?,mr
"पोषण ट्रॅकर अँप्लिकेशनचा उद्देश आहे की त्यातून अंगणवाडी सेंटर (एडब्ल्यूसी), अंगणवाडी सेविकांची सेवा पुरवठा (एडब्ल्यूडब्ल्यू ), गर्भवती महिला, स्तनपान करणारी माता व मुले यांचे संपूर्ण लाभार्थी व्यवस्थापन, अशा सगळ्याचा एक ३६०°आढावा घेऊ शकतो.",mr
"प्रस्तावित प्रणाली आपल्याला परिभाषित निर्देशकांवर सर्व एडब्ल्यूसी, एडब्ल्यूडब्ल्यू आणि लाभार्थ्यांचे वास्तविक-वेळ देखरेख आणि ट्रॅक करण्यास सक्षम करेल.",mr
आपण पोशन ट्रॅकर अ‍ॅप डाउनलोड कसे करू शकतो?,mr
पोषण ट्रॅकर केवळ अँड्रॉइड आवृत्तीसाठी उपलब्ध आहे.,mr
मोबाइलमध्ये पोषण ट्रॅकर अॅप स्थापित करण्यासाठी किमान आवश्यक काय आहे?,mr
पॉशन ट्रॅकर अॅप केवळ अँड्रॉइड फोन ६.० आणि त्यावरील आवृत्तीसह स्थापित केला जाऊ शकतो.,mr
एक अंगणवाडी सेविका लाभार्थी एका अंगणवाडी केंद्र मधून दुसर्‍या अंगणवाडी केंद्र मध्ये त्यांच्या आधार क्रमांकाच्या आधारे स्थलांतरित करण्यासाठी ‘माइग्रेट लाभार्थी’ पर्याय वापरू शकतो.,mr
लाभार्थीची पात्रता काय आहे?,mr
एक लाभार्थी महिन्यातून किमान 21 दिवस टीएचआर साठी पात्र आहे.,mr
होम रेशनसाठी कोण पात्र आहे?,mr
"गरोदर महिला, स्तनपान करणार्‍या माता, 6 महिने ते 3 वर्षे वयोगटातील मुले आणि किशोरवयीन मुली.",mr
होम रेशनबद्दल मी कुठे चौकशी करू शकतो?,mr
कृपया तुमच्या संबंधित अंगणवाडी सेविकेशी संपर्क साधा.,mr
अतिरिक्त पूरक आहारासाठी कोण पात्र आहे.,mr
पोषणाची कमतरता म्हणून ओळखली जाणारी मुले अतिरिक्त आहार पूरक आहारांसाठी पात्र आहेत.,mr
एक लाभार्थी एका महिन्यात किमान 21 दिवस एचसीएम साठी पात्र असतो.,mr
गरम शिजवलेल्या जेवणासाठी कोण पात्र आहे?,mr
कृपया तुमच्या संबंधित अंगणवाडी केंद्राशी संपर्क साधा.,mr
अतिरिक्त पूरक आहारासाठी कोण पात्र आहे?,mr
"मुलांमध्ये खुंटणे, अशक्तपणा, कमी वजनाचे प्रमाण आणि पोषण सेवा वितरणाचा शेवटचा माइल ट्रॅकिंग यासाठी पोषण ट्रॅकर अंतर्गत तंत्रज्ञानाचा वापर केला जात आहे.",mr
पोषण ट्रॅकर अंगणवाडी कर्मचार्‍यांना त्यांच्या प्रयत्नांचे प्रतिबिंब देऊन कार्यक्षमतेने सेवा पुरवण्यासाठी नोकरी-सहाय्य आहे.,mr
पोषण अभियानांतर्गत हा एक गंभीर आणि लाभार्थी-केंद्रित सेवा वितरण अनुप्रयोग आहे जो विश्लेषणासह वास्तविक वेळेच्या डेटाला प्रोत्साहन देईल.,mr
हे केंद्रीकृत डेटा आर्किटेक्चर वापरून तयार केले गेले आहे जे इतर मंत्रालये आणि कार्यक्रमांच्या डिजिटल तंत्रज्ञान प्रणालींशी देखील संरेखित होते.,mr
"अंगणवाडी केंद्र (अंगणवाडी केंद्र), अंगणवाडी सेविकांच्या सेवा वितरण (अंगणवाडी सेविकाs) आणि गरोदर महिला, स्तनदा माता आणि मुलांसाठी संपूर्ण लाभार्थी व्यवस्थापनाचे 360-अंश दृश्य प्रदान करणे हे उद्दिष्ट आहे.",mr
सार्वजनिक डॅशबोर्ड लाभार्थ्यांना दिल्या जाणाऱ्या सेवांमध्ये पारदर्शकता आणण्यास मदत करतो.,mr
"होम रेशन(टीएचआर) आणि गरम शिजवलेले जेवण (एचसीएम), नवजात बालकांसाठी आणि गर्भवती महिलांसाठी लसीकरण यासारख्या सेवा.",mr
"खुंटणे, अशक्तपणा आणि कमी वजनाचे प्रमाण यासारखे आरोग्य निर्देशक डब्ल्यूएचओ मानकांनुसार मोजले जातात.",mr
नियमित वाढीचे निरीक्षण केल्याने अंगणवाडी सेविका ला मुलांना संबंधित आणि वेळेवर सहाय्य प्रदान करण्यात मदत होते.,mr
हे लाभार्थी आणि कर्तव्य धारकांच्या वास्तविक वेळेच्या उपस्थितीचे दस्तऐवजीकरण करून वितरण प्रणालीचे कार्यक्षम ऑडिट देखील सुनिश्चित करते.,mr
"ही व्यवस्थापन माहिती प्रणाली पोषण कार्यक्रमास कार्यक्षमतेने मापन करण्यास मदत करेल, ज्यामुळे सकारात्मक प्रभाव निर्माण आणि दस्तऐवजीकरण होईल.",mr
इंटरनेटशिवाय आप मध्ये प्रवेश केला जाऊ शकतो का?,mr
वैध इंटरनेट कनेक्शनशिवाय अ‍ॅप कार्य करत नाही.,mr
पोषण ट्रॅकर अॅपचे लक्ष्यित यूजरबेस कोण आहेत?,mr
"अंगणवाडी सेविका, अंगणवाडी केंद्रे, लाभार्थ्यांचा डेटा फॉर्ममध्ये टाकण्यासाठी पोषण ट्रॅकर अ‍ॅप आहे.",mr
हे सर्वसामान्यांसाठी अजिबात विकसित केलेले नाही.,mr
पोषण ट्रॅकर अॅपमध्ये लॉग इन कसे करावे?,mr
एडब्ल्यूडब्ल्यू ला लॉगिन स्क्रीनमध्ये त्यांचे मोबाइल नंबर प्रविष्ट करण्याची विनंती केली जाते.,mr
आपल्या नोंदणीकृत मोबाइल नंबरवर एक ओटीपी पाठविला जाईल जो आपण आपला एमपीन म्हणून सेट करणे आवश्यक आहे.,mr
एमपीन म्हणजे काय?,mr
एमपीन हा ४ अंकांचा पासकोड आहे जो पोषण ट्रॅकर अॅप वर नोंदणी करताना अंगणवाडी सेवकाने सेट केला असतो.,mr
एमपीआयएन संबंधित मोबाईल क्रमांकावर ओटीपीची विनंती करुन संबंधित अंगणवाडी सेवकाद्वारे सेट केले जाऊ शकते.,mr
डेटाबेसमध्ये मोबाइल नंबर आधीपासून अस्तित्त्वात असल्यास संबंधित अंगणवाडी व्यक्तीस नोंदणीकृत मोबाइल क्रमांकावर ४ अंकी ओटीपी मिळेल.,mr
ओटीपी टाकल्यावर एडब्ल्यूडब्ल्यू सहजपणे सानुकूलित एमपीन सेट करू शकते.,mr
एमपीन कधी आणि कसा वापरावा?,mr
"पोषण ट्रॅझर अ‍ॅपवर लॉग इन करताना, एडब्ल्यूडब्ल्यू ने त्यांच्याद्वारे सेट केलेला एमपीन प्रविष्ट करणे आवश्यक आहे.",mr
हे एमपीन पोषण ट्रॅकर अॅप चालविण्यासाठी पासकोड म्हणून काम करेल आणि लाभार्थी फॉर्ममध्ये माहिती प्रविष्ट करेल.,mr
एमपीन रीसेट कसे करावे?,mr
एमपीआयएन सहजपणे कोणत्याही एडब्ल्यूडब्ल्यू / एडब्ल्यूसी वापरकर्त्याद्वारे रीसेट केले जाऊ शकते.,mr
"आपल्याला विसरलेले एमपीन वर क्लिक करणे आवश्यक आहे, आणि आपला नोंदणीकृत मोबाइल नंबर प्रविष्ट करणे आवश्यक आहे.",mr
आपल्या नोंदणीकृत मोबाइल नंबरवर आपल्याला ओटीपी प्राप्त होईल आणि आपण आपल्या एमपीनला रीसेट करू शकता.,mr
पोषण ट्रॅकर अ‍ॅप किती भाषांमध्ये उपलब्ध आहे?,mr
पोषण ट्रॅकर अॅप २२ वेगवेगळ्या भाषांमध्ये उपलब्ध आहे.,mr
एडब्ल्यूडब्ल्यू केवळ इंग्रजी भाषेमध्ये फॉर्म भरू शकतात.,mr
पोषण ट्रॅकर अॅपमध्ये किती भिन्न प्रकारचे फॉर्म आहेत?,mr
लाभार्थींसाठी ७ वेगवेगळे प्रकारचे फॉर्म आहेत.,mr
एएनडब्ल्यूडब्ल्यूला विशिष्ट अंगणवाडी केंद्रात असलेल्या पायाभूत सुविधांशी संबंधित तपशील प्रविष्ट करणे आवश्यक आहे.,mr
"यामध्ये संरचना, मूलभूत सुविधा, सुविधा, स्वच्छता, पिण्याचे पाणी इत्यादींचा समावेश आहे.",mr
अ‍ॅडब्ल्यूडब्ल्यूएस त्यांच्या मोबाईल नंबरद्वारे नोंदणी करण्यात अक्षम असल्यास अॅपवर कसे साइन अप करू शकते?,mr
आपण पोशन ट्रॅकर डॅशबोर्डमध्ये प्रवेश कसा करू शकतो?,mr
एखादा एडब्ल्यूडब्ल्यू / एडब्ल्यूसी कसा जोडू शकतो ?,mr
एडब्ल्यूडब्ल्यू / एडब्ल्यूसी फक्त नोडल स्तराच्या अधिकाऱ्याद्वारे जोडले जाऊ शकतात.,mr
पदानुक्रमात वरीलपैकी कोणीही.,mr
"राष्ट्रीय स्तराप्रमाणेच राज्य, जिल्हा, प्रकल्प आणि क्षेत्र पातळीवरील वापरकर्ता तयार करू शकतो.",mr
"राज्यस्तरीय वापरकर्ता जिल्हा, प्रकल्प आणि क्षेत्र पातळीवरील वापरकर्ता तयार करू शकतो, जिल्हास्तरीय वापरकर्ता प्रकल्प आणि क्षेत्र पातळीचा वापरकर्ता तयार करू शकतो, प्रकल्प स्तराचा वापरकर्ता क्षेत्र स्तराचा वापरकर्ता तयार करू शकतो.",mr
पोषण ट्रॅकर डॅशबोर्डवर किती वेगवेगळ्या प्रकारचे अहवाल तयार केले जाऊ शकतात?,mr
हाताळणी व समर्थनासाठी आम्ही दररोज संध्याकाळी ३ ते सायंकाळी ५ या वेळेत व्हिडीओ कॉन्फरन्सद्वारे उपलब्ध आहोत.,mr
"एमजीआरएसने मोठ्या प्रमाणावर भिन्न वांशिक पार्श्वभूमी आणि सांस्कृतिक सेटिंग्जमधील (ब्राझील, घाना, भारत, नॉर्वे, ओमान आणि यूएसए) अंदाजे 8500 मुलांकडून प्राथमिक वाढ डेटा आणि संबंधित माहिती गोळा केली.",mr
नवीन वाढ वक्र एकच आंतरराष्ट्रीय मानक प्रदान करेल जे जन्मापासून ते पाच वर्षे वयोगटातील सर्व मुलांच्या शारीरिक वाढीचे सर्वोत्तम वर्णन करेल आणि स्तनपान करवलेल्या बाळाला वाढ आणि विकासासाठी आदर्श मॉडेल म्हणून स्थापित करेल.,mr
आपले आरोग्य कसे पुनरुज्जीवित करावे?,mr
"साइटला भेट देऊन किंवा वापरून, आपण वेळोवेळी अद्यतनित केल्यानुसार या अटींशी स्पष्टपणे सहमत आहात.",mr
"आपण या अटींच्या कोणत्याही भागाशी सहमत नसल्यास, साइट वापरू नका.",mr
कोणतेही बदल किंवा अद्यतने त्वरित प्रभावी होतील.,mr
बदलांसाठी वेळोवेळी या वापर अटी तपासण्याची जबाबदारी तुम्ही घेणे.,mr
"साइटद्वारे ऑफर केलेली काही वैशिष्ट्ये किंवा सेवा वापरण्याचा तुमचा हेतू असल्यास, तुम्हाला तुमच्या मोबाइल नंबरसह खात्यासाठी नोंदणी करणे आवश्यक आहे.",mr
"या अटी मान्य करून, तुम्ही आम्हाला तुमची ओळख माहिती (आधार तपशीलांसह) आणि तुमच्या खात्यात नोंदणीकृत इतर सर्व सदस्यांची देखील वापरण्यासाठी अधिकृत करण्यास स्पष्टपणे सहमत आहात.",mr
तुमची वैयक्तिक माहिती आणि नोंदणी आणि ही माहिती सुरक्षित ठेवण्यात तुम्ही अयशस्वी झाल्यामुळे होणार्‍या सर्व क्रियाकलापांची गोपनीयता राखण्यासाठी तुम्ही पूर्णपणे जबाबदार आहात.,mr
तुमच्या खात्यात किंवा मोबाईल नंबरमध्ये त्या व्यक्तीची तोतयागिरी करण्याच्या हेतूने दुसर्‍या व्यक्तीचे नाव समाविष्ट नसावे.,mr
तुम्ही दुसऱ्या वापरकर्त्याचे खाते त्यांच्या परवानगीशिवाय वापरू नये.,mr
"तुम्हाला तुमच्या खात्याचा कोणताही अनधिकृत वापर किंवा इतर खाते-संबंधित सुरक्षा उल्लंघन आढळल्यास, तुम्ही आम्हाला त्वरित लेखी सूचित कराल.",mr
तुमचे खाते दुसऱ्याच्या अधिकारांचे उल्लंघन करत असल्याची किंवा आमच्या धोरणांचे उल्लंघन करत असल्याची तक्रार आम्हाला मिळाल्यास आम्ही तुमचे खाते रद्द करू किंवा ब्लॉक करू.,mr
"साइटवर प्रदर्शित केलेल्या कोणत्याही कॅप्चाच्या संदर्भात सामग्री किंवा साइटची रचना, किंवा सादरीकरण.",mr
आम्ही साइटची सामग्री आणि वैशिष्ट्ये कधीही बदलू शकतो.,mr
"साइटवर प्रदर्शित केलेले नोंदणीकृत आणि अनोंदणीकृत ट्रेडमार्क, लोगो आणि सेवा चिन्ह आमच्या किंवा आमच्या परवानाधारकांच्या मालकीचे आहेत.",mr
"तुम्ही आमचे ट्रेडमार्क, लोगो आणि सेवा चिन्ह कोणत्याही प्रकारे ओ शिवाय वापरू शकत नाही.",mr
या वेबसाइटवर वैशिष्ट्यीकृत सामग्री विनामूल्य पुनरुत्पादित केली जाऊ शकते.,mr
"तथापि, साइटचा कोणताही भाग आणि कोणतीही सामग्री कॉपी, पुनर्प्रकाशित, पुनरुत्पादित, अपलोड, पोस्ट, सार्वजनिकरित्या प्रदर्शित, एन्कोड, अनुवादित, प्रसारित किंवा इतर कोणत्याही संगणकावर, सर्व्हरवर, वेब साइटवर किंवा प्रकाशनासाठी इतर माध्यमांवर कोणत्याही प्रकारे वितरित केली जाऊ शकत नाही.",mr
अपमानास्पद रीतीने किंवा दिशाभूल करणाऱ्या संदर्भात.,mr
"तुम्ही साइटवर उपलब्ध असलेल्या माहितीचा वापर करू शकता, जर तुम्ही (1) अशी माहिती केवळ तुमच्या वैयक्तिक, गैर-व्यावसायिक माहितीच्या उद्देशाने वापराल आणि अशी माहिती कोणत्याही नेटवर्क संगणकावर कॉपी किंवा पोस्ट करू नका किंवा ती कोणत्याही मीडियामध्ये प्रसारित करू नका, (2) अशा कोणत्याही माहितीमध्ये आणि अशा दस्तऐवज आणि सामग्रीशी संबंधित कोणतेही अतिरिक्त प्रतिनिधित्व किंवा वॉरंटीमध्ये कोणतेही बदल करू नका.",mr
"जेथे सामग्री प्रकाशित केली जात आहे किंवा इतरांना जारी केली जात आहे, तेथे स्त्रोत ठळकपणे मान्य करणे आवश्यक आहे.",mr
भाषांतरे सर्वोत्कृष्ट प्रयत्नांच्या आधारावर केली जात असली तरी काही भाग चुकीचे असू शकतात.,mr
वेबसाइटवरील काही फाइल्स आणि इतर गोष्टींचे भाषांतर केले जाऊ शकत नाही.,mr
"याव्यतिरिक्त, भाषांतरावर, भाषेच्या अडथळ्यांमुळे काही अनुप्रयोग आणि/किंवा सेवा अपेक्षेप्रमाणे कार्य करू शकत नाहीत.",mr
