data,language
"या वेबसाइट्स लिंक्ड़ आहेत हे तथ्य, आमच्याकडून या वेबसाइट्सचे कोणतेही समर्थन सूचित करत नाही, कारण या वेबसाइट्सवर आमचे कोणतेही नियंत्रण आहे.",mr
आम्ही या वेबसाइट्ससाठी कोणतीही सामग्री किंवा या वेबसाइट्सच्या गोपनीयता पद्धतींसह जबाबदार नाही.,mr
या वेबसाइट्सच्या वापराच्या अटींशी परिचित होण्यासाठी आम्ही तुम्हाला जोरदार प्रोत्साहन देतो.,mr
या वेबसाइट्सचा तुमचा वापर तुमच्या स्वतःच्या जोखमीवर आणि धोक्यात आहे.,mr
"तुम्ही निवडलेल्या लिंक्स किंवा तुम्ही डाउनलोड करू शकणारे कोणतेही सॉफ्टवेअर व्हायरस, वर्म्स, ट्रोजन हॉर्स, दोष, डेट बॉम्ब, टाईम बॉम्ब आणि इतर किंवा इतर संगणक प्रोग्रामिंग दिनचर्यापासून मुक्त आहेत याची खात्री करण्यासाठी आवश्यक ती खबरदारी घेणे केवळ तुमच्यावर अवलंबून आहे.",mr
आम्ही असे प्रतिनिधित्व करत नाही की साइटवर किंवा त्याद्वारे उपलब्ध असलेली सामग्री योग्य आहे किंवा इतर ठिकाणी उपलब्ध आहे.,mr
आम्ही साइट किंवा साइटवर वर्णन केलेल्या कोणत्याही सेवा किंवा उत्पादनाची उपलब्धता कोणत्याही व्यक्ती किंवा भौगोलिक क्षेत्रासाठी कोणत्याही वेळी मर्यादित करू शकतो.,mr
तुमच्यावरील कोणत्याही तपासात किंवा खटला चालवण्यात मदत करण्यासाठी तुमच्या व्यवहारांशी संबंधित तुम्ही आम्हाला प्रदान केलेली माहिती आम्ही कायद्याची अंमलबजावणी करू शकतो.,mr
आम्हाला योग्य वाटेल अशी कायदेशीर कारवाई आम्ही करू शकतो.,mr
"पोषण ट्रॅकर पोर्टल किंवा ॲप भारत सरकारच्या महिला आणि बाल विकास मंत्रालयाद्वारे नियंत्रित केले जाते, यापुढे “एमडब्ल्यूसीडी”, “आमचे”, “आम्ही”, “आम्ही” म्हणून संबोधले जाईल ज्यामध्ये इतर विभाग आणि विभागांचा संदर्भ समाविष्ट असेल कार्यक्रम/मोहिम.",mr
"आम्ही कोणती माहिती गोळा करतो, ती का गोळा करतो आणि ती कशी वापरली आणि शेअर केली जाते हे समजून घेण्यास मदत करण्यासाठी हे गोपनीयता धोरण आहे.",mr
तुमची माहिती गोळा करणारी आणि ठेवणारी एजन्सी एमडब्ल्यूसीडी आहे.,mr
आम्ही तुमच्या वैयक्तिक माहितीच्या सुरक्षिततेचे रक्षण करण्यासाठी आणि तुमच्या गोपनीयतेचे रक्षण करण्यासाठी वचनबद्ध आहोत.,mr
"सिस्टीमवर संकलित केलेली आणि प्रक्रिया केलेली कोणतीही माहिती किंवा डेटा माहिती तंत्रज्ञान कायदा, 2000 च्या नियमांनुसार आणि वैयक्तिक डेटाच्या संकलन आणि प्रक्रियेशी संबंधित इतर राष्ट्रीय आणि राज्य कायद्यांसह वाचलेल्या तरतुदींनुसार केला जातो.",mr
तुमचा प्रणालीचा प्रवेश आणि वापर हे गोपनीयता धोरण आणि सेवा अटी तुमच्या स्वीकृतीवर सशर्त आहे.,mr
"सिस्टीममध्ये प्रवेश करून आणि/किंवा वापरून, तुम्ही प्रतिनिधित्व करता की तुम्ही सेवा अटी आणि गोपनीयता धोरण वाचले आहे, समजले आहे आणि त्यांना बांधील आहात आणि तुम्ही तुमची माहिती आणि डेटा संकलित, संग्रहित आणि मांडलेल्या पद्धतीने वापरण्यास संमती देता.",mr
या गोपनीयता धोरणामध्ये.,mr
तुम्ही याद्वारे कबूल करता की या गोपनीयता धोरणाच्या कलम 1 मध्ये वर्णन केल्यानुसार तुमची माहिती संग्रहित करणे या गोपनीयता धोरणाच्या कलम 2 आणि 3 मध्ये निर्दिष्ट केलेल्या उद्देशांची पूर्तता करण्यासाठी आवश्यक आहे.,mr
"तुम्ही आमच्या सेवा वापरता तेव्हा तुम्ही दिलेली सामग्री आणि इतर माहिती आम्ही गोळा करतो, ज्यामध्ये तुम्ही खात्यासाठी साइन अप करता तेव्हा.",mr
"तथापि, तुम्ही वैयक्तिक डेटा शेअर न करणे निवडू शकता जेथे डेटा प्रदान करणे पर्यायी आहे.",mr
1.2. सेवांच्या वापरावरून माहिती.,mr
"तुम्ही आमच्या साइट्स, ॲप आणि प्लॅटफॉर्म तंत्रज्ञानासह आमच्या सेवांना भेट देता किंवा अन्यथा वापरता तेव्हा आम्ही वापर डेटा लॉग करतो.",mr
"आम्ही कुकीज, स्थानिक स्टोरेज, जसे की ब्राउझर वेब स्टोरेज किंवा ऍप्लिकेशन डेटा कॅशे, डेटाबेस आणि काही विशिष्ट प्रकरणांमध्ये तुमची माहिती गोळा करण्यासाठी आणि वापरण्यासाठी सर्व्हर लॉगसह माहिती गोळा आणि संग्रहित करण्यासाठी विविध तंत्रज्ञानाचा वापर करू शकतो.",mr
1.3. तृतीय पक्षांकडून माहिती.,mr
आमची सिस्टीम तृतीय-पक्ष साइट्सना एपीआय प्रदान करते जी तुमची वैयक्तिक माहिती संकलित करू शकते.,mr
पोषण ट्रॅकर अशा माहितीच्या सुरक्षिततेसाठी किंवा त्यांच्या गोपनीयता पद्धती किंवा त्या तृतीय पक्षाच्या साइट्सच्या सामग्रीसाठी कोणत्याही प्रकारे जबाबदार नाही.,mr
"याव्यतिरिक्त, तृतीय पक्ष साइट्सच्या काही पृष्ठांवर तुम्हाला कुकीज किंवा इतर तत्सम उपकरणे देखील आढळू शकतात आणि पोषण ट्रॅकरद्वारे हे स्पष्ट केले आहे की प्रणाली या तृतीय-पक्ष साइट्सद्वारे कुकीजच्या वापरावर नियंत्रण ठेवत नाही.",mr
या तृतीय-पक्ष सेवा प्रदाते आणि तृतीय-पक्ष साइट्सची त्यांची स्वतःची गोपनीयता धोरणे असू शकतात जी तुमची माहिती साठवून ठेवण्यासाठी आणि ठेवण्यावर नियंत्रण ठेवू शकतात ज्यांच्या तुम्ही अधीन असाल.,mr
"हे गोपनीयता धोरण या तृतीय-पत्नींना प्रदान केलेली, संग्रहित केलेली किंवा वापरली जाणारी कोणतीही माहिती नियंत्रित करत नाही.",mr
"आम्ही शिफारस करतो की तुम्ही तृतीय-पक्षाच्या साइटमध्ये प्रवेश करता तेव्हा, तुम्ही तृतीय पक्षाच्या साइटच्या गोपनीयता धोरणाचे पुनरावलोकन करा कारण ते तुमच्या माहितीच्या सुरक्षेशी संबंधित आहे.",mr
तुम्ही सहमत आहात आणि कबूल करता की शोध परिणामांमध्ये किंवा कोणत्याही तृतीय-पक्ष साइटद्वारे प्रकाशित केलेल्या माहितीसाठी पोषण ट्रॅकर जबाबदार राहणार नाही.,mr
"कलम 1 अंतर्गत संकलित केलेली माहिती, लाभार्थींच्या आरोग्याच्या सुविधेसाठी वापरली जाईल.",mr
"आम्ही आमची उत्पादने प्रदान करतो, ज्यामध्ये सिस्टमची माहिती/डेटा/ सामग्री आणि सामग्री अद्यतनित करणे, सुरक्षित करणे आणि समस्यानिवारण करणे तसेच समर्थन प्रदान करणे समाविष्ट आहे.",mr
"जेव्हा तुम्ही पोषण ट्रॅकर वर नोंदणी करता, तेव्हा तुम्ही ज्या मोबाईल नंबरने नोंदणी केली होती, तो मोबाईल नंबर डेटाबेसमधून तुमचा रेकॉर्ड शोधण्यासाठी वापरला जाईल.",mr
पोषण ट्रॅकर प्रणालीमध्ये नोंदवल्याप्रमाणे आरोग्य स्थितीचे मूल्यांकन करण्यासाठी देखील याचा वापर केला जाऊ शकतो.,mr
2.2. तुमच्याशी संवाद साधणे.,mr
"आम्ही तुमच्या नोंदणीकृत मोबाइल नंबरवर तुम्हाला नोंदणीबद्दल सूचना देण्यासाठी एसएमएस देखील पाठवतो, तुम्ही आमच्याशी संपर्क साधता तेव्हा तुम्हाला प्रतिसाद देण्यासाठी आणि तक्रारींची तपासणी करण्यासाठी, प्रतिसाद देण्यासाठी आणि सेवा समस्यांसाठी (उदा.",mr
बग) आम्ही तुमची माहिती वापरतो.,mr
2.3. पडताळणी.,mr
खाती पडताळण्यात मदत करण्यासाठी आम्ही आमच्याकडे असलेली माहिती वापरतो.,mr
पोषण ट्रॅकर नियंत्रण आणि प्रतिसादाच्या उद्देशाने आरोग्य स्थितीच्या पडताळणीसाठी रेकॉर्डचा वापर केला जाऊ शकतो.,mr
2.4. सुरक्षा आणि ऑडिट.,mr
"आम्‍ही तुमचा डेटा (तुमच्‍या संप्रेषणांसह) सुरक्षिततेच्‍या उद्देशांसाठी वापरतो किंवा संभाव्य फसवणूक किंवा आमच्या सेवा अटींचे इतर उल्लंघन आणि/किंवा आमचे सदस्य, अभ्यागत किंवा इतरांना हानी पोहोचवण्‍याचा प्रयत्‍न रोखण्‍यासाठी किंवा तपासण्‍यासाठी करतो.",mr
प्रणालीच्या सुरक्षितता आणि मापनक्षमतेसाठी पोषण ट्रॅकर प्रणालीचे नियमितपणे एमडब्ल्यूसीडीद्वारे गुंतलेल्या ऑडिटर्सद्वारे ऑडिट केले जाते.,mr
अशा ऑडिटसाठी नोंदी वापरल्या जाऊ शकतात.,mr
2.5. संशोधन आणि ऑपरेशनल क्रियाकलाप.,mr
"आम्ही आमच्या सेवा ऑपरेट करण्यासाठी देखील डेटा वापरतो, ज्यामध्ये आमच्या कार्यप्रदर्शनाचे विश्लेषण करणे, आमच्या कायदेशीर दायित्वांची पूर्तता करणे, आमचे कार्यबल विकसित करणे आणि संशोधन करणे समाविष्ट आहे.",mr
प्रणालीच्या सुधारणेसाठी आणि प्रणालीच्या तरतुदीशी संबंधित सर्व आनुषंगिक किंवा सहायक कृतींसाठी आणि नवीन तंत्रज्ञान आणि सेवा विकसित आणि प्रदान करण्यासाठी आम्ही काही आवश्यक ऑपरेशन करण्यासाठी देखील माहिती वापरू शकतो.,mr
2.6. सर्वेक्षण आणि अभिप्राय.,mr
ही यंत्रणा व्यवस्थेचे कार्यप्रदर्शन आणि अनुभवाबद्दल फीडबॅक देखील घेते.,mr
"उपरोक्त कलम 1 अंतर्गत नोंदणीच्या वेळी तुमच्याकडून गोळा केलेली वैयक्तिक माहिती सुरक्षितपणे संग्रहित केली जाईल आणि ती केवळ भारत सरकार किंवा राज्य सरकारे आरोग्य प्रगती आणि स्थितीचा मागोवा घेण्यासाठी, अहवाल तयार करण्यासाठी, उष्णतेचे नकाशे आणि इतर सांख्यिकी यासाठी वापरली जाईल.",mr
"देशातील पोषण ट्रॅकरच्या व्यवस्थापनाच्या उद्देशाने व्हिज्युअलायझेशन,.",mr
तुमचा संदर्भ आयडी (मोबाइल नंबर) वरील कलम 1 नुसार तुमच्याशी एसएमएसद्वारे संवाद साधण्यासाठी केवळ तुमच्या वैयक्तिक माहितीशी सह-संबंधित असेल.,mr
3.2. कायदेशीर खुलासे.,mr
"कायदेशीर विनंती, सबपोना किंवा इतर कायदेशीर प्रक्रियेला प्रतिसाद म्हणून आम्ही तुमची माहिती ऍक्सेस करू शकतो, जतन करू शकतो आणि शेअर करू शकतो किंवा (1) फसवणूक किंवा बेकायदेशीर क्रियाकलापांबद्दल चौकशी, प्रतिबंध किंवा कारवाई करण्यासाठी खुलासा करणे वाजवीपणे आवश्यक आहे असा सद्भावनापूर्ण विश्वास असल्यास किंवा सरकारी अंमलबजावणी संस्थांना मदत करण्यासाठी; (2) तुमच्यासोबतचे आमचे करार लागू करा; (3) कोणत्याही तृतीय-पक्षाच्या दाव्यांविरुद्ध किंवा आरोपांविरुद्ध तपास करा आणि स्वतःचा बचाव करा; (4) आमच्या सेवांच्या सुरक्षिततेचे किंवा अखंडतेचे रक्षण करा (जसे की अशाच प्रकारच्या धोक्यांचा सामना करणाऱ्या कंपन्यांशी शेअर करून); किंवा (5) कोणत्याही व्यक्तीचे अधिकार आणि सुरक्षितता वापरणे किंवा त्यांचे संरक्षण करणे.",mr
"कलम 1 अंतर्गत गोळा केलेली सर्व वैयक्तिक माहिती ऍप्लिकेशन सर्व्हरवर ठेवली जाईल, ज्या प्रमाणात अशी माहिती कार्यक्रमासाठी नोंदणीकृत लोकांशी संबंधित असेल.",mr
"येथे नमूद केलेली कोणतीही गोष्ट पोषण ट्रॅकरच्या नोंदणीकृत वापरकर्त्यांच्या वैयक्तिक डेटाद्वारे व्युत्पन्न केलेल्या अनामित, एकत्रित डेटासेटवर किंवा अशा डेटासेटचा वापर करून तयार केलेले कोणतेही अहवाल, उष्णता नकाशे किंवा इतर व्हिज्युअलायझेशनवर लागू होणार नाही.",mr
"तथापि, बदल केवळ पोषण ट्रॅकर प्रणालीद्वारे वेळोवेळी निर्धारित केल्यानुसारच केले जाऊ शकतात.",mr
तुम्ही आमच्याकडून प्राप्त झालेले संप्रेषण किंवा ते कसे प्राप्त करता ते तुम्ही व्यवस्थापित करू शकत नाही.,mr
"पुढे, जेव्हाही तुम्ही सिस्टीमवरील तुमचे खाते किंवा त्यासंबंधी कोणतीही माहिती बदलता किंवा ऍक्सेस करता तेव्हा आम्ही सुरक्षित सर्व्हर वापरण्याची ऑफर देतो.",mr
"हे पुढे स्पष्ट करण्यात आले आहे की, जोपर्यंत तुम्ही प्रणालीमध्ये प्रवेश करता आणि/किंवा वापरता (प्रत्यक्ष किंवा अप्रत्यक्षपणे), तुम्ही हे सुनिश्चित करण्याचे बंधन तुमच्याकडे आहे की, तुम्ही, तुमच्या शेवटी, पुरेशा भौतिक, व्यवस्थापकीय आणि तांत्रिक सुरक्षेचे पालन कराल.",mr
", तुमच्या डेटाची अखंडता आणि सुरक्षितता जपण्यासाठी ज्यामध्ये तुमची वैयक्तिक माहिती समाविष्ट असेल आणि ती मर्यादित नसेल.",mr
बदलांसाठी तुम्ही या गोपनीयता धोरणाचे नियमितपणे पुनरावलोकन करावे.,mr
"आम्ही या गोपनीयता धोरणातील कोणत्याही भौतिक बदलांबद्दल सर्व वापरकर्त्यांना सूचित करण्यासाठी व्यावसायिकदृष्ट्या वाजवी प्रयत्न करू, जसे की सिस्टमवरील सूचना.",mr
"तथापि, सिस्टमचा वापरकर्ता म्हणून, कोणत्याही बदलांसाठी तुम्ही नियमितपणे गोपनीयता धोरण तपासले पाहिजे.",mr
"आम्ही या गोपनीयता धोरणाच्या शीर्षस्थानी \""अंतिम अद्यतनित\"" तारीख देखील अद्यतनित करू, जी या गोपनीयता धोरणाची प्रभावी तारीख दर्शवते.",mr
नवीन गोपनीयता धोरणाच्या तारखेनंतर तुमचा सतत प्रवेश किंवा सिस्टमचा वापर नवीन गोपनीयता धोरणाची तुमची स्वीकृती बनवते.,mr
"तुम्ही नवीन गोपनीयता धोरणाशी सहमत नसल्यास, तुम्ही सिस्टममध्ये प्रवेश करणे आणि/किंवा वापरणे थांबवणे आवश्यक आहे.",mr
"तुम्ही याद्वारे कबूल करता की तुमच्या माहितीचे कोणतेही संकलन, स्टोरेज, प्रक्रिया किंवा इतर वापर हे अशा संकलन, स्टोरेज, प्रक्रिया किंवा इतर वापराच्या वेळी लागू असलेल्या गोपनीयता धोरणाद्वारे नियंत्रित केले जातील.",mr
