data,language
ABHA के उपयोग द्वारा आपके और आपके परिवार के लिए (स्वास्थ्य पहचान पत्र) सुरक्षित और सक्षम डिजिटल स्वास्थ्य और अभिलेखों को संरक्षित करने की दिशा में उठाया गया पहला कदम है।,hi
"यह आपके स्वास्थ्य प्रदाता के साथ आपको व्यवहार्य कुशल बनाता है, और आपको सत्यापित स्वास्थ्य पेशवरों और स्वास्थ्य प्रदाताओं से मूल रूप से डिजिटल स्वास्थ्य अभिलेखों, पर्चियों एवं निदानों को प्राप्त करने की अनुमति प्रदान करता है।",hi
"पोषण अभियान, एक लक्षित दृष्टिकोण और अभिसरण द्वारा बच्चों, किशोरों, गर्भवती महिलाओं और स्तनपान कराने वाली माताओं के लिए पोषण संबंधी परिणामों में सुधार करने के लिए भारत का प्रमुख कार्यक्रम है।",hi
पोषण ट्रैकर लॉन्च करने का उद्देश्य क्या है?,hi
"पोषण ट्रैकर एप्लिकेशन का उद्देश्य आंगनवाड़ी केंद्र (एडब्ल्यूसी), आंगनवाड़ी कर्मचारी (एडब्ल्यूडब्ल्यू) की सेवा प्रदान करने वाली गतिविधियों और गर्भवती महिलाओं, स्तनपान कराने वाली माताओं और बच्चों के लिए पूर्ण लाभार्थी प्रबंधन की गतिविधियों का 360 डिग्री दृश्य प्रदान करना है।",hi
"प्रस्तावित प्रणाली को सभी एडब्ल्यूसी, एडब्ल्यू डब्ल्यू और लाभार्थियों को परिभाषित संकेतक पर वास्तविक समय की निगरानी और समझना सक्षम करना चाहिए।",hi
पोषण ट्रैकर ऐप को कैसे डाउनलोड किया जा सकता है?,hi
क्या ऐप्पल आई स्टोर पर भी पोषण ट्रैक ऐप उपलब्ध है?,hi
कोई पोषण ट्रैकर केवल एंड्रॉइड संस्करण के लिए उपलब्ध नहीं है।,hi
मोबाइल में पोषण ट्रैकर ऐप इंस्टॉल करने के लिए न्यूनतम आवश्यकता क्या है?,hi
पोषण ट्रैकर ऐप केवल एंड्रॉइड फोन में एंड्रॉइड संस्करण 6.0 और इसके बाद के संस्करण में स्थापित किया जा सकता है।,hi
एक आँगनवाड़ी कार्यकर्ता अपनी आधार संख्या के आधार पर किसी लाभार्थी को एक आँगनवाड़ी केंद्र से दूसरे आँगनवाड़ी केंद्र में स्थानांतरित करने के लिए 'माइग्रेट लाभार्थी' के विकल्प का उपयोग कर सकता है।,hi
लाभार्थी की पात्रता क्या है?,hi
एक लाभार्थी महीने में कम से कम 21 दिनों के लिए THR के लिए पात्र है।,hi
टेक होम राशन के लिए कौन पात्र है?,hi
"गर्भवती महिलाएँ, स्तनपान कराने वाली माताएँ, 6 महीने से 3 वर्ष तक के बच्चे और किशोर लड़कियाँ।",hi
मैं टेक होम राशन के बारे में कहाँ पूछ सकता हूँ?,hi
"कृपया, अपने संबंधित आँगनवाड़ी कार्यकर्ता से संपर्क करें।",hi
अतिरिक्त पूरक भोजन के लिए कौन पात्र है।,hi
पोषण की कमी वाले बच्चों के रूप में पहचाना जाने वाले बच्चे अतिरिक्त पूरक आहार के लिए पात्र हैं।,hi
एक लाभार्थी महीने में कम से कम 21 दिनों के लिए HCM के लिए पात्र है।,hi
गर्म पके हुए भोजन के लिए कौन पात्र है?,hi
"कृपया, अपने संबंधित आँगनवाड़ी केंद्र से संपर्क करें।",hi
अतिरिक्त पूरक आहार के लिए कौन पात्र है?,hi
"पोषण ट्रैकर के तहत प्रौद्यौगिकी का उपयोग स्टंटिंग, वेस्टिंग, कम वजन वाले बच्चों की पहचान और पोषण सेवा के वितरण को गतिशील पहचान देने में किया जा सकता है।",hi
यह पोषण अभियान के तहत महत्वपूर्ण और लाभार्थी केन्द्रित सेवा वितरण एप्लिकेशन है जो वास्तविक समयावधि के साथ विश्लेषण को भी प्रोत्साहित करेगा।,hi
इसका निर्माण केंद्रीकृत आँकड़ों के ढाँचों का उपयोग करके किया जाता है जिसमें अन्य मंत्रालय और उनके कार्यक्रम डिजिटल प्रणाली द्वारा एक संरेखित होते हैं।,hi
"इसका उद्देश आँगनवाड़ी केन्द्रों की गतिविधियों, आँगनवाड़ी कार्यकर्ताओं की सेवा वितरण, और गर्भवती महिलाओं, स्तनपान कराने वाली महिलाओं और बच्चों के सम्पूर्ण लाभार्थी प्रबंधन का 360 डिग्री अर्थात चौतरफा दृष्टिकोण प्रदान करना है।",hi
पब्लिक डैसबोर्ड का प्रमुख कार्य लाभार्थी को प्रदत सेवा में पारदर्शिता को बनाए रखने में सहायता प्रदान करना है।,hi
"स्वास्थ्य संकेतक जैसे-स्टंटिंग, वेस्टिंगऔर कम वजन से संबंधित मामलों को विश्व स्वास्थ्य संगठन के मानक के अनुसार मापा जाता है।",hi
बच्चों को प्रासंगिक और आवधिक सहायता प्रदान करने में नियमित विकास निगरानी आँगनवाड़ी कार्यकर्ताओं को सक्षम बनाता है।,hi
यह लाभार्थियों और कर्तव्य धारकों की वास्तविक सामयिक उपस्थिति का दस्तावेजीकरण करके वितरण प्रणाली की कुशल लेखा परीक्षा की भी सुनिश्चितता करता है।,hi
यह प्रबंधन सूचना प्रणाली पोषण कार्यक्रम और उससे संबंधित दस्तावेजीकरण की कुशलता से वृद्धि करते हुए सकारात्मक प्रभाव को उत्पन्न करने में सहायता करेगी।,hi
(इस मासिक बैठक की आवश्यकता क्यों हैं?,hi
आँगनबाड़ी कार्यकर्ता 48 घंटे के अंदर आपसे संपर्क करेगी।,hi
क्या ऐप को इंटरनेट के बिना अभिगम किया जा सकता है?,hi
कोई भी ऐप वैध इंटरनेट कनेक्शन के बिना काम नहीं करती है।,hi
पोषण ट्रैकर ऐप के टारगेट यूज़रबेस कौन हैं?,hi
पोषण ट्रैकर ऐप आंगनवाड़ी कार्यकर्ताओं के लिए है जो आंगनवाड़ी केंद्रों के लाभार्थियों के डेटा को प्रपत्रों में दर्ज करता है।,hi
यह आम जनता के लिए बिल्कुल भी विकसित नहीं है।,hi
पोषण ट्रैकर ऐप में कैसे लॉगिन करें?,hi
एडब्ल्यूडब्ल्यू से अनुरोध है कि लॉगिन स्क्रीन में अपने मोबाइल नंबर दर्ज करें।,hi
"आपके पंजीकृत मोबाइल नंबर पर एक ओटीपी भेजा जाएगा जिसकी आपको आवश्यकता है, अपना एमपीआईएन स्थापित करें।",hi
एमपीआईएन क्या है?,hi
जो आंगनवाड़ी कार्यकर्ता द्वारा पोषण ट्रैकर ऐप पर पंजीकरण करते समय निर्धारित किया जाता है।,hi
एमपीआईएन कैसे निर्धारित करें?,hi
एमपीआईएन को संबंधित आंगनवाड़ी कार्यकर्ता द्वारा अपने मोबाइल नंबर पर ओटीपी के लिए अनुरोध किया जा सकता है।,hi
"यदि मोबाइल नंबर पहले से ही डेटाबेस में मौजूद है, तो संबंधित आंगनवाड़ी व्यक्ति को पंजीकृत मोबाइल नंबर पर 4 अंकों का ओटीपी प्राप्त होगा।",hi
"ओटीपी दर्ज करने के बाद, एडब्ल्यूडब्ल्यू आसानी से अनुकूलित एमपीआईएन निर्धारित कर सकता है।",hi
एमपीआईएन कब और कैसे इस्तेमाल करें?,hi
"पोषण ट्रैकर ऐप में लॉगिन करते समय, एडब्ल्यूडब्ल्यू को उनके द्वारा निर्धारित एमपीआई में प्रवेश करना होता है।",hi
यह एमपीआईएन पोषण ट्रैकर ऐप चलाने और लाभार्थियों के फॉर्म में जानकारी दर्ज करने के लिए एक पासकोड के रूप में कार्य करेगा।,hi
एमपीआईएन कैसे दोबारा निर्धारित करें?,hi
एमपीआईएन को किसी भी एडब्ल्यूडब्ल्यू / एडब्ल्यूसी उपयोगकर्ता द्वारा आसानी से दोबारा निर्धारित किया जा सकता है।,hi
"आपको भूल गए एमपीआईएन पर क्लिक करना होगा, और अपना पंजीकृत मोबाइल नंबर दर्ज करना होगा।",hi
आपको अपने पंजीकृत मोबाइल नंबर पर ओटीपी प्राप्त होगा और आप अपने एमपीआईएन को आसानी से दोबारा निर्धारित कर सकते हैं।,hi
पोषण ट्रैकर ऐप कितनी भाषाओं में उपलब्ध है?,hi
पोषण ट्रैकर ऐप 22 अलग-अलग भाषाओं में उपलब्ध है।,hi
एडब्ल्यूडब्ल्यू अंग्रेजी भाषा में ही फॉर्म भर सकता है।,hi
पोषण ट्रैकर ऐप में कितने विभिन्न रूप हैं?,hi
लाभार्थियों के लिए 7 विभिन्न प्रकार के फॉर्म हैं।,hi
एडब्ल्यूडब्ल्यू एक विशेष आंगनवाड़ी केंद्र में मौजूद बुनियादी ढांचे से संबंधित विवरण दर्ज करने के लिए आवश्यक हैं।,hi
"इसमें संरचना, बुनियादी सुविधाएं, सुख-सुविधाएँ, स्वच्छता, पेयजल आदि शामिल हैं।",hi
"अगर वे अपने मोबाइल नंबरों के माध्यम से पंजीकरण करने में असमर्थ हैं, तो एडब्ल्यूडब्ल्यू ऐप पर साइन अप कैसे कर सकता है?",hi
वे प्रणाली में नए जोड़े गए हैं और उनका मोबाइल नंबर अभी तक राज्य सेल द्वारा एमओडब्ल्यूसीडी को प्रदान नहीं किया गया है।,hi
उपरोक्त दोनों मामलों में राज्य नोडल अधिकारियों को एडब्ल्यूडब्ल्यू में से किसी को जोड़ने / संपादित / सक्रिय / निष्क्रिय करने का अधिकार है।,hi
पोषण ट्रैकर डैशबोर्ड तक कोई कैसे पहुंच सकता है?,hi
पोषण ट्रैकर डैशबोर्ड को डैशबोर्ड पर साइन करके पहुँचा जा सकता है।,hi
कोई एडब्ल्यूडब्ल्यू / एडब्ल्यूसी कैसे जोड़ सकता है?,hi
एडब्ल्यूडब्ल्यू / एडब्ल्यूसी को केवल नोडल स्तर के अधिकारी द्वारा जोड़ा जा सकता है।,hi
पदानुक्रम में ऊपर की ओर कोई भी।,hi
"राष्ट्रीय स्तर के उपयोगकर्ता के रूप में राज्य, जिला, परियोजना और क्षेत्र स्तर उपयोगकर्ता बना सकते हैं।",hi
"राज्य स्तर का उपयोगकर्ता जिला, परियोजना और क्षेत्र स्तर का उपयोगकर्ता बना सकता है, जिला स्तर का उपयोगकर्ता परियोजना और क्षेत्र स्तर का उपयोगकर्ता बना सकता है, परियोजना स्तर का उपयोगकर्ता क्षेत्र का उपयोगकर्ता बना सकता है।",hi
पोषण ट्रैकर डैशबोर्ड पर कितने विभिन्न प्रकार के अभिलेख उत्पन्न की जा सकती हैं?,hi
पोषण ट्रैकर समूह से support-poshantrackr@gov.in पर ईमेल भेजकर संपर्क किया जा सकता है।,hi
आपके सहयोग और समर्थन के लिए हम प्रतिदिन शाम 4:15 बजे से शाम 5:15 बजे तक वीडियो कॉन्फ्रेंस पर भी उपलब्ध हैं।,hi
क्या कोई लाभार्थी आवेदन के उपयोग द्वारा सीधे पंजीकरण कर सकता है।,hi
"हमारी साइट पर आकर इसका उपयोग करने का सामान्य अर्थ यह निकाला जाता है कि, आप हमारे द्वारा सामयिक आधार पर किए जाने वाले अद्यतन से संबंधित शर्तों के प्रति अपनी सहमति व्यक्त करते हैं।",hi
"यदि आप इन शर्तों के किन्हीं भाग से सहमत नहीं हैं, तो कृपया, इस साइट का उपयोग न करें।",hi
"यदि आप अनुबंध के लिए आवश्यक कानूनी पात्रता पूरी नहीं करते हैं, तो आप हमारी साइट या इससे संबंधित किसी शर्त का उपयोग नहीं कर सकते हैं।",hi
किसी भी प्रकार के परिवर्तन और अद्यतन को त्वरित रूप से प्रभावशाली माना जाएगा।,hi
यह आपका उत्तरदायित्व है कि आप सामयिक आधार पर शर्तों के उपयोग में होने वाले परिवर्तनों की जाँच करते रहें।,hi
हमारी साइट के पुनरीक्षण के बाद आपके द्वारा उसका निरंतर उपयोग हमारी संशोधित शर्तों के प्रति आपकी स्वीकृति को प्रदर्शित करता है।,hi
"आपको अपने खाते के लिए मोबाइल संख्या के साथ पंजीकरण करना अनिवार्य है, यदि आप साइट द्वारा प्रदत किन्हीं विशिष्ट सेवाओं या विशेषताओं का उपयोग करने चाहते हैं।",hi
"इन शर्तों को स्वीकार करने के द्वारा आप हमें अपनी सूचना, पहचान (आधार विवरण सहित) और आपके खाते में पंजीकृत अन्य सभी सदस्यों की सूचना का उपयोग करने हेतु अधिकारिक रूप से अपनी सहमति प्रदान करते हैं।",hi
आप अपनी व्यक्तिगत सूचना और पंजीकरण तथा संबंधित जानकारी को सुरक्षित रखने में विफल होने के परिणामस्वरूप भावी सभी गतिविधियों की गोपनीयता बनाए रखने हेतु पूर्णत: उत्तरदायी हैं।,hi
आपके पंजीकरण या मोबाइल नंबर को गोपनीय रखा जाएगा।,hi
आपके खाते या मोबाइल नंबर में आपका रूप धारण करने के इरादे से किसी अन्य व्यक्ति के नाम को शामिल नहीं किया जाएगा।,hi
आप उनकी आज्ञा के बिना किसी अन्य के खाते का उपयोग नहीं करेंगे।,hi
आप हमें त्वरित रूप से इस बात की सूचना देंगे यदि आपने अपने खाते में किसी अनधिकृत उपयोग या सुरक्षा से संबद्ध किसी उल्लंघन को करते हुए पाया है।,hi
"यदि हमें कोई शिकायत मिलती है कि, आपका खाता किसी और के अधिकारों या हमारी नीतियों का उल्लंघन करता है, तो हम आपके खाते को रद्द या अवरुद्ध कर सकते हैं।",hi
"आप साइट पर प्रतिभागियों को पंजीकृत करने के लिए विभिन्न इंटरनेट प्रोटोकॉल में पते या मोबाइल नंबर, या किसी अन्य माध्यम से अपनी पहचान को गुप्त रखने का प्रयास नहीं करेंगे।",hi
"आप आपके साइटों के उपयोग पर लागू होने वाले या किसी भी तीसरे पक्ष के अधिकारों को प्रभावित करने वाले सभी केंद्रीय एवं राज्य कानूनों, नियमों और विनियमों का पालन करेंगे।",hi
"आप साइट के माध्यम से प्रतिभागियों को पंजीकृत करने, शोध करने हेतु बॉट तकनीक का उपयोग नहीं करेंगे; किसी भी प्रकार के संदेह से बचाव हेतु यह विशेष रूप से आपकी साइट पर स्वचालित आधार पर स्क्रिप्ट या स्वचालित सॉफ़्टवेयर का उपयोग करने से रोकता है और आपको साइट पर किसी भी सुरक्षा उपाय एक्सेस कंट्रोल सिस्टम या अन्य तकनीकी नियंत्रण या माप को बाधित करने से रोकता है जिसका उपयोग किसी मोबाइल नंबर से जुड़े प्रतिभागियों के पंजीकरण नियमों के एकीकरण की सीमा को लागू करने या बनाए रखने के लिए किया जाता है।",hi
हम किसी भी समय साइट की सामग्री और सुविधाओं में परिवर्तन कर सकते हैं।,hi
"इस साइट पर प्रदर्शित पंजीकृत और अपंजीकृत ट्रेडमार्क, प्रतीक चिह्न और सेवा चिह्न हमारे या हमारे लाइसेंसकर्ताओं के स्वामित्व के अधीन है।",hi
