en,hi,translated_helsinki
"The Poshan Tracker enables real-time monitoring and tracking of all AWCs and beneficiaries on defined indicators. It is built using centralized data architecture that also aligns with the digital technology systems of other ministries and programs. The objective is to provide a 360-degree view of the activities of the Anganwadi Centre (AWC), service deliveries of Anganwadi Workers (AWWs) and complete beneficiary management for pregnant women, lactating mothers and children. The public dashboard helps to impart transparency on services delivered to beneficiaries.","यह पोषण ट्रैकर परिभाषित संकेतकों के आधार पर वास्तविक समयावधि और सभी आँगनवाड़ी कार्यकर्ताओं के साथ-साथ लाभार्थियों की ट्रैकिंग और निगरानी सक्षम बनाता है। इसका निर्माण केंद्रीकृत आँकड़ों के ढाँचों का उपयोग करके किया जाता है जिसमें अन्य मंत्रालय और उनके कार्यक्रम डिजिटल प्रणाली द्वारा एक संरेखित होते हैं। इसका उद्देश आँगनवाड़ी केन्द्रों की गतिविधियों, आँगनवाड़ी कार्यकर्ताओं की सेवा वितरण, और गर्भवती महिलाओं, स्तनपान कराने वाली महिलाओं और बच्चों के सम्पूर्ण लाभार्थी प्रबंधन का 360 डिग्री अर्थात चौतरफा दृष्टिकोण प्रदान करना है। पब्लिक डैसबोर्ड का प्रमुख कार्य लाभार्थी को प्रदत सेवा में पारदर्शिता को बनाए रखने में सहायता प्रदान करना है।.","This setting enables the actual duration and monitoring of the tracker on the basis of the indicators defined by the tracker, along with all the generator operators. It is used to build blocks of centralised data, where other software and their programs are coordinated by their digital system. Its purpose is to provide information on the methods of distribution of the engine centres, the services of the engine operators, and pregnant women, women and children. The results of the entire laboratory are described in a 360 degree description."
Services Delivered,प्रदत सेवा,Assigned Service
"Tracking of services to the end beneficiary at a click of a button. Services like Take Home Ration (THR) and Hot cooked Meal (HCM), vaccination for Infants and Pregnant Women.","एक बटन के क्लिक द्वारा लाभार्थी के साथ-साथ सेवाओं की अंतिम रूप से ट्रैकिंग करना। टेक होम राशन, हॉट कुक्ड मील, गर्भवती महिलाओं और बच्चों के टीकाकरण जैसी सेवाएँ-.","By clicking on a button, you'll be able to track services with your partner. Tek home resolution, hotcut miles, pregnant women and children's criticism services."
Growth Measurement,वृद्धि/विकास माप,Size of the expander arrow
"Children of different age groups are monitored on monthly basis by AWWs. Health indicators like Stunting, Wasting and Underweight prevalence are measured as per WHO standards. Regular growth monitoring helps AWWs to provide relevant and timely assistance to children.","AWW द्वारा मासिक आधार पर विभिन्न आयु वाले बच्चों की निगरानी करना। स्वास्थ्य संकेतक जैसे-स्टंटिंग, वेस्टिंगऔर कम वजन से संबंधित मामलों को विश्व स्वास्थ्य संगठन के मानक के अनुसार मापा जाता है। बच्चों को प्रासंगिक और आवधिक सहायता प्रदान करने में नियमित विकास निगरानी आँगनवाड़ी कार्यकर्ताओं को सक्षम बनाता है।.",Monitoring children of different ages on a monthly basis by AWW. Health indicators are measured according to the standards of the World Health Organization. They enable regular development monitor operators to provide administrative and periodic assistance to children.
Home Visit Alerts,गृह-यात्रा संकेतक,_Home Page:
"The Poshan Tracker generates automated alerts to the critical last-mile beneficiaries. It also ensures efficient audit of the delivery system by documenting real time attendance of beneficiaries and duty bearers. This management information system will help the nutrition programme to scale efficiently, thereby generating and documenting positive impact.",पोषण ट्रैकर लाभार्थियों के महत्वपूर्ण स्व-चालित संकेतकों का निर्माण करता है। यह लाभार्थियों और कर्तव्य धारकों की वास्तविक सामयिक उपस्थिति का दस्तावेजीकरण करके वितरण प्रणाली की कुशल लेखा परीक्षा की भी सुनिश्चितता करता है। यह प्रबंधन सूचना प्रणाली पोषण कार्यक्रम और उससे संबंधित दस्तावेजीकरण की कुशलता से वृद्धि करते हुए सकारात्मक प्रभाव को उत्पन्न करने में सहायता करेगी।.,Determines whether to create important autostart indicators for the forwarding of developers. This also ensures that the distribution system's convenient documentation is documented by documenting the actual presence of the developers and the task manager. This feature will help you to generate a positive effect by increasing your system's browsing capacity and related documentation.
Learning Videos,विडियो से सीखना,Learn From the Video
How to take care of weak newborn with the help of Kangaroo Mother Care,कंगारु मदर केयर के साथ अपने कमजोर नवजात बच्चों की देखभाल कैसे करें,How to take care of your weak newborn children with kangaroo metro Cairo
Preventing illnesses to avert Malnutrition and Death,कुपोषण और मृत्यु पर रोक के संदर्भ में बीमारियों से बचाव,Protection From Diseases With regard to the Prevention of Cosmosis and Death
Prevention of Anemia in children and adolescents girls,बच्चों और किशोरियों में होने वाली रक्त की कमी से बचाव,Avoid lower blood pressure in children and adolescents
Birth Preparedness- For Institutional and Home Delivery,जन्म से पूर्व तैयारी-नैदानिकों और गृह प्रसव के संदर्भ में,In connection with pre-birth preparations and house-to-house celebrations
Care of the weak newborn baby - How many weak babies are we missing?,कमजोर नवजात शिशु की देखभाल- हमारे द्वारा कितने कमजोर शिशुओं की अनदेखी हुई है?,How many weak children have we had to care for?
Feeding During Illness,बीमारी के दौरान स्तनपान,"When I was sick, I had to go to a hospital."
Preparation During Pregnancy - For NewBorn Care & Family Planning,गर्भावस्था के दौरान की जाने वाली तैयारी- नवजातों की देखभाल और परिवार नियोजन के संदर्भ में,Caring for preparations for pregnancy and family planning
Ensuring Exclusive Breastfeeding,त्वरित रूप से स्तनपान को सुनिश्चित करना,Confirm expeditiously Column
Assessment of growth in children,बच्चों में विकास का मूल्यांकन,The Value of Development in Children
Preventing anemia in women,महिलाओं का एनीमिया से बचाव,Protection From Women’s Anonymity
Complementary Feeding - Diet Diversity,पूरक स्तनपान-विविधता पूर्ण आहार,Complete column header-diversity complete
Identification and care of a Weak Newborn baby,कमजोर नवजात शिशु की पहचान और देखभाल,"The New World Translation of the Holy Scriptures — With References states: “The sons of the true God began to notice the daughters of men, that they were good - looking; and they went taking wives for themselves, namely, all whom they chose. ”"
Observing Breastfeeding In Newborn Babies,नवजात शिशुओं के स्तनपान संबंधी मामलों पर ध्यान देना,Focusing on New Children’s Stimulating Matters
Planning And Organising Community Based Events At AWC,आँगनवाड़ी केंद्र पर सामुदायिक आधार पर कार्यक्रमों की योजना बनाना एवं उसे व्यवस्थित करना,Design and organise programs on a social basis at the center of the calendar
Making or Updating Home Visit Planner and Initiating home visits,देखभाल कर्ता की गृह यात्रा संबंधी योजनाओं का निर्माण करना और उन्हें अद्यतित करते रहना,Create and update caret travel plans
Ensuring that complementary feeding improves over time,समय के साथ पूरक आधार की सुनिश्चिता करना,Assurance of full - time support
How to ensure timely initiation of complementary feeding,पूरक पोषण की आवधिक सुनिश्चितता कैसे करें,How to provide long-term confirmation of complete submission
Identifying and preventing Severe Acute Malnutrition,गंभीर कुपोषण की पहचान और बचाव,Recognizing and Safeguarding Serious Confusion
Identification & Referral of Sick Newborn,संदर्भित बीमार नवजात की पहचान,Recognizing the Consequences of Disease
Supporting mothers with issues in Breastfeeding,स्तनपान कराने में अक्षम महिलाओं के लिए सहायता प्रदान करने वाली माताएँ,Mothers who are unable to cook help for women who are unable to cook
Why this Monthly Meeting?,मासिक बैठक की अनिवार्यता? (इस मासिक बैठक की आवश्यकता क्यों हैं?),Disability of a monthly meeting? (Why does this monthly meeting need?)
Awareness,जागरूकता,Brightness
ALL ,सभी ,All
GENERAL ,सामान्य ,General
Pregnant Women ,गर्भवती महिलाएं ,pregnant women
Lactating Mothers ,स्तनपान कराने वाली महिलाएँ ,Women Who Stood Up
CHILD CARE ,बाल देखभाल ,Child Care
General,आम,General
Download PDF,PDF डाउनलोड करें,Download PDF
General Awareness about Growth Monitoring of Children,बच्चों के विकास से संबंधित निगरानी के बारे में सामान्य जागरूकता,General Watch for Children’s Development
General Awareness about preventing illness in Children,बच्चों में बीमारियों से बचाव के बारे में सामान्य जागरूकता,Common Caution to Protect Children From Diseases
General Awareness for Pregnancy,गर्भावस्था पर सामान्य जागरूकता,A common wake - up attitude toward pregnancy
General Awareness on Module,मॉड्यूल पर सामान्य जागरूकता,The normal opacity of the module
General Awareness on Anaemia,एनीमिया पर सामान्य जागरूकता,A common wakefulness on an animation
General Awareness on SAM and MAM,SAM और MAM पर सामान्य जागरूकता,Common Look at SAM and MAM
General Awareness on Mother Care,मातृत्व देखभाल पर सामान्य जागरूकता,A mother’s common alertness in caring for her baby is not surprising.
General Awareness on the Delivery of the child,बच्चे के प्रसव पर सामान्य जागरूकता,A common awareness of a child’s upbringing
Pregnant Women,गर्भवती महिलाएं,pregnant women
Awareness for Pregnancy in Preventing Anemia,गर्भावस्था के दौरान एनीमिया से बचाव पर जागरूकता,Protection From Anonymity During Pregnancy
Lactating Mothers,स्तनपान कराने वाली महिलाएँ,Women Who Stood Up
Awareness for Lactating Mother Complimentary Feeding for Children,बच्चों को स्तनपान कराने वाली महिलाओं के पूरक आहार के बारे में जागरूकता,Watching the Food Supplies of Children
Awareness to Lactating Mother,स्तनपान कराने वाली माताओं में जागरूकता,Awake! of Awake!
"Awareness for Children Stunting, Wasting to prevent malnutrition in children","बच्चों में कुपोषण को रोकने के लिए स्टंटिंग, वेस्टिंग के प्रति जागरुकता",Stands up against the Westing to prevent exposure to children
Growth Monitoring Assessment Charts,विकास निगरानी मूल्यांकन तालिका,Cannot initialise Evolution's mail component.
Stunted Assessment Parameters,स्टंटेड मूल्यांकन मापदंड,Standard Depreciation
Wasted Assessment Parameters,वेस्टेड मूल्यांकन मापदंड,Westted Valued Scale
Underweight Assessment Parameters,कम वजन वाले मूल्यांकन मापदंड,Lowest Rating Rating
Manuals,नियमावली,Can not initialise the Ximian Evolution shell.
Poshan Tracker Process Flow,पोषण ट्रैकर प्रक्रिया प्रवाह,Ongoing blanking process
Circulars/Notifications,परिपत्र/अधिसूचनाएँ,Forms/Notifications
03 June,03 जून,June 03
Clarification regarding Cost of Smart phones,स्मार्ट फोन की लागत के संदर्भ में स्पष्टीकरण,Explanation of Smart Phones
24 May,24 मई,24 May
Uploading of Data of Anganwadi Services Schemes in Poshan Tracker,पोषण ट्रैकर में आँगनवाड़ी सेवा योजनाओं के आँकड़े को अपलोड करना,Uploading data to junk service schemes in junk tracer
01 March,03 जून,June 03
Data Plan for Mobile Application,मोबाइल एप्लिकेशन के लिए डेटा प्लान,Data plan for mobile applications
02 February,02 फरवरी,February 02
Specifications of Smart phone and Technical Compatibility Testing,स्मार्ट फोन के विनिर्देश और तकनीकी संगतता परीक्षण,Smart phone instruction and technical compatibility test
Training on ICT Platform under POSHAN Abhiyaan,पोषण अभियान के तहत ICT प्लैटफ़ार्म पर प्रशिक्षण,Training on ICT platforms at the bottom of the polling process
New Poshan Tracker App - CSC-SPV Nodal Person,नया पोषण ट्रैकर एप्प-CSC-SPV नोडल व्यक्ति,New query tracker app-CSC-SPV node
13 January,13 जनवरी,13 JANUARY
New Poshan Tracker App,नया पोषण ट्रैकर एप्प,New Query Tracker Up
