en,te,translated_helsinki
"The Site is directed to the people residing in India. We do not represent that Content available on or through the Site is appropriate or available in other locations. We may limit the availability of the Site or any service or product described on the Site to any person or geographic area at any time. If you choose to access the Site from outside India, you do so at your own risk.","ఈ సైట్ భారతదేశంలో నివసిస్తున్న ప్రజలకు నిర్దేశించబడింది. సైట్ లో లేదా దాని ద్వారా లభ్యం అయ్యే కంటెంట్ సముచితమైనది లేదా ఇతర లొకేషన్ ల్లో లభ్యం అవుతుందని మేం ప్రాతినిధ్యం వహించం. సైట్ లేదా సైట్ పై వివరించిన ఏదైనా సర్వీస్ లేదా ప్రొడక్ట్ యొక్క లభ్యతను ఏ సమయంలోనైనా ఏదైనా వ్యక్తి లేదా భౌగోళిక ప్రాంతానికి మేం పరిమితం చేయవచ్చు. ఒకవేళ మీరు భారతదేశం వెలుపల నుంచి సైట్ ని యాక్సెస్ చేసుకోవాలని ఎంచుకున్నట్లయితే, మీరు మీ స్వంత రిస్క్ తో అలా చేస్తారు.","This site is distributed in the hope that it will be useful, but WITHOUT ANY WARRANTY; without even the implied warranty of MERCHANTABILITY or FITNESS FOR A PARTICULAR PURPOSE. See the GNU General Public Licence for more details."
XI. VIOLATION OF THESE TERMS,XI. ఈ నిబంధనల ఉల్లంఘన,XI. The length of these covenants.
"We may investigate any violation of these Terms, including unauthorized use of the Site. We may provide law enforcement with information you provide to us related to your transactions to assist in any investigation or prosecution of you. We may take legal action that we feel is appropriate. If we determine that you have violated these Terms or the law, or for any other reason or for no reason, we may block your account and will prevent you from accessing the Site at any time without notice to you.","సైట్ యొక్క అనధీకృత ఉపయోగంతో సహా, ఈ నిబంధనల యొక్క ఏదైనా ఉల్లంఘనను మేము పరిశోధించవచ్చు. మీ యొక్క ఏదైనా ఇన్వెస్టిగేషన్ లేదా ప్రాసిక్యూషన్ లో సాయపడటం కొరకు మీ లావాదేవీలకు సంబంధించి మీరు మాకు అందించే సమాచారంతో మేం లా ఎన్ ఫోర్స్ మెంట్ ని అందించవచ్చు. సముచితమని మేము భావించే చట్టపరమైన చర్య తీసుకోవచ్చు. మీరు ఈ నిబంధనలు లేదా చట్టాన్ని ఉల్లంఘించారని లేదా ఏదైనా ఇతర కారణం వల్ల లేదా ఏ కారణం లేకుండా ఉల్లంఘించారని మేము నిర్ధారించినట్లయితే, మేము మీ ఖాతాను నిరోధించవచ్చు మరియు మీకు నోటీసు ఇవ్వకుండా ఏ సమయంలోనైనా సైట్ ని యాక్సెస్ చేసుకోకుండా మిమ్మల్ని నిరోధిస్తాము.","We can also investigate any distortions of these covenants by using the unsubstantiated use of the site. We can provide us with information about your ancestors that we can provide. We can take legal action that we think is appropriate. If you have violated these treaties or the law or have failed for any other reason or for no other reason, we can do nothing to prevent you from doing anything."
XII. RE-DISTRIBUTION,XII. పునః పంపిణీ,XII. Resend
"Authorized organizations shall not re-distribute any data that they are able to access through the API/ No-code webpage integration and shall ensure that integration of all such data shall compulsorily be limited to the specific services provided by Poshan Tracker. Under no circumstances, shall an organization use the data collected as part of the Poshan Abhiyaan of the Government for any purposes other than the purposes specified herein, and as may be permitted by the government.","అధీకృత సంస్థలు API/నో-కోడ్ వెబ్ పేజీ ఇంటిగ్రేషన్ ద్వారా యాక్సెస్ చేసుకోగల ఏదైనా డేటాను తిరిగి పంపిణీ చేయరాదు మరియు అటువంటి మొత్తం డేటా యొక్క ఇంటిగ్రేషన్ తప్పనిసరిగా పోషణ్ ట్రాకర్ ద్వారా అందించబడే నిర్ధిష్ట సేవలకు మాత్రమే పరిమితం చేయబడుతుందని ధృవీకరించాలి. ఎట్టి పరిస్థితుల్లోనూ, ప్రభుత్వం యొక్క పోషణ్ అభియాన్ లో భాగంగా సేకరించిన డేటాను, ఇక్కడ పేర్కొనబడ్డ ఉద్దేశ్యాలు కాకుండా, మరియు ప్రభుత్వం ద్వారా అనుమతించబడ్డ ఏదైనా ఇతర ప్రయోజనాల కొరకు ఒక సంస్థ ఉపయోగించరాదు.","The main organisations should ensure that no data can be returned by accessing the API/No-code web page by way of streaming, and that such data can only be restricted to certain services provided by the mailbox tracker. In such cases, data collected by the government's mail service provider will not be used for any other purposes specified here, and the government will not be used for any other purposes."
"XIII. COMPLIANCE WITH LAW, THIRD PARTY RIGHTS, AND OTHER TERMS OF SERVICE","XIII. చట్టం, తృతీయపక్ష హక్కులు మరియు ఇతర సేవా నిబంధనలతో సమ్మతి వహించడం","XIII. Conformity with the law, the rights of the party and other service agreements"
"The authorized organizations will comply with all applicable laws, regulation, policies and third-party rights (including and without limitation, any laws regarding the import or export of data or software, privacy, and local laws) established by Government of India. These organizations will not use the APIs/ No-code webpage integration to encourage or promote illegal activity or violation of third-party rights including these Terms with Poshan Tracker.","అధీకృత సంస్థలు భారత ప్రభుత్వం ద్వారా ఏర్పాటు చేయబడ్డ అన్ని వర్తించే చట్టాలు, రెగ్యులేషన్ లు, పాలసీలు మరియు తృతీయపక్ష హక్కులకు (డేటా లేదా సాఫ్ట్ వేర్, గోప్యత మరియు స్థానిక చట్టాల యొక్క దిగుమతి లేదా ఎగుమతికి సంబంధించిన ఏవైనా చట్టాలతో సహా మరియు పరిమితి లేకుండా) కట్టుబడి ఉంటాయి. పోషణ్ ట్రాకర్ తో ఈ నిబంధనలతో సహా చట్టవ్యతిరేక కార్యకలాపం లేదా తృతీయపక్ష హక్కుల ఉల్లంఘనను సంహరించడానికి లేదా ప్రోత్సహించడానికి ఈ సంస్థలు APIలు/నో-కోడ్ వెబ్ పేజీ ఇంటిగ్రేషన్ ను ఉపయోగించవు.","All laws, regulations, regulations and copyright rights are established by the government established by the parent organisations (data or software rights, including the import or import of or without restrictions on the import or export of any of the data or software or local laws). These institutions do not use API/Noo-cod web page entry to kill or encourage copyright abuse with these agreements with post-trafficker."
XIV. CORRECTNESS OF DATA PROVIDED BY THIRD PARTY SYSTEMS,XIV. తృతీయపక్ష సిస్టమ్ ల ద్వారా అందించబడ్డ డేటా యొక్క కచ్చితత్త్వం,XIV. The accuracy of data provided by hardware systems
"The ASPs collecting data from Poshan Tracker and displaying to users shall be solely responsible for the correctness of such data and any liability arising out of any data so provided, shall completely rest with such third party. Any liabilities civil or criminal, arising out of any incorrect data, shall solely lie with the concerned ASP.","పోషణ్ ట్రాకర్ నుంచి డేటాను సేకరించే మరియు యూజర్ లకు డిస్ ప్లే చేసే ఎఎస్ పిలు అటువంటి డేటా యొక్క కచ్చితత్త్వానికి పూర్తిగా బాధ్యత వహిస్తారు మరియు అలా అందించబడ్డ ఏదైనా డేటా నుంచి ఉత్పన్నం అయ్యే ఏదైనా బాధ్యత పూర్తిగా అటువంటి తృతీయపక్షానికి ఉంటుంది. ఏదైనా తప్పుడు డేటా వల్ల ఉత్పన్నమయ్యే ఏవైనా అప్పులు సివిల్ లేదా క్రిమినల్, పూర్తిగా సంబంధిత ASP వద్దనే ఉంటాయి.","The ES calls that collects data from the mailbox tracker and displays them to users will be fully responsible for the availability of such data and will be entirely responsible for any data produced from any given data. Any data produced by any incorrect data will be at the Civil or Terminal, completely related to the ASP."
XV. INDEMNITY AND LIMITATION OF LIABILITY,XV. నష్టపరిహారం మరియు బాధ్యత యొక్క పరిమితి,XV. Consumables and limits of liability
"You agree to defend, indemnify and hold harmless Poshan Tracker and its affiliates, its officers, directors, employees and agents, from and against any and all claims, damages, obligations, losses, liabilities, costs or debt, and expenses including but not limited to attorneys fees relating to any allegation or third-party legal proceeding to the extent arising from:","పోషణ్ ట్రాకర్ మరియు దాని అఫిలియేట్ లు, దాని అధికారులు, డైరెక్టర్ లు, ఉద్యోగులు మరియు ఏజెంట్ లు, ఏవైనా మరియు అన్ని క్లెయింలు, డ్యామేజీలు, బాధ్యతలు, నష్టాలు, అప్పులు, ఖర్చులు లేదా రుణం, మరియు ఖర్చుల నుంచి మరియు వాటికి విరుద్ధంగా మరియు వాటి నుంచి మరియు వాటికి విరుద్ధంగా మరియు వాటి నుంచి ఉత్పన్నం అయ్యేంత వరకు ఏదైనా ఆరోపణ లేదా తృతీయపక్ష లీగల్ ప్రొసీడింగ్ కు సంబంధించిన అటార్నీల ఫీజులతో సహా అయితే వాటికే పరిమితం కాకుండా, వాటి నుంచి రక్షణ కల్పించడానికి, నష్టపరిహారం చెల్లించడానికి మరియు హానిచేయకుండా ఉంచడానికి మీరు అంగీకరిస్తున్నారు:","The mail trucker and its affiliates, its officials, its directors, employees and agents, whatever and all the clinics, diamonds, responsibilities, losses, charges, charges or damages, and against them and against them and against them, and against them, and against them, and against them, and from them, and from them, and from them, and from them, and from them, and they are not produced and produced from them, but not restricted to them, but not limited to them, so as to protect them, to pay the damage and not to harm them:"
Your use of and access to the Site and Service;,సైట్ మరియు సేవకు మీ ఉపయోగం మరియు ప్రాప్యత;,The site and service you are using and access;
Your violation of any term of this Agreement;,ఈ అగ్రిమెంట్ యొక్క ఏదైనా టర్మ్ ని మీరు ఉల్లంఘించడం;,You're breaking up any term of this argument;
"Your violation of any third party right, including without limitation, any copyright, property, or privacy right; or","పరిమితి లేకుండా, ఏదైనా కాపీరైట్, ఆస్తి లేదా గోప్యతా హక్కుతో సహా ఏదైనా తృతీయపక్ష హక్కును మీరు ఉల్లంఘించడం; లేదా","Without limit, you violate any copyright with the right to copyright, property or privacy; or"
Any claim that your User Content caused damage to a third party. This defense and indemnification obligation will survive this Agreement and your use of the Service and Website/App.,మీ యూజర్ కంటెంట్ తృతీయపక్షానికి నష్టం కలిగించిందనే ఏదైనా క్లెయిం. ఈ రక్షణ మరియు నష్టపరిహార బాధ్యత ఈ ఒప్పందం మరియు సేవ మరియు వెబ్ సైట్/యాప్ యొక్క మీ ఉపయోగం మనుగడలో ఉంటుంది.,There is something that seems to have lost your user quota configuration. This security and damage management responsibility will be considered your use of this agreement and service and web site/jap.
XVI. JURISDICTION,XVI. అధికారపరిధి,XVI. Administration
Your use of the Site and any dispute arising out of such use of the Site is subject to the laws of India and place of jurisdiction shall be New Delhi.,సైట్ యొక్క మీ ఉపయోగం మరియు సైట్ యొక్క అటువంటి ఉపయోగం వల్ల తలెత్తే ఏదైనా వివాదం భారతదేశం యొక్క చట్టాలకు లోబడి ఉంటుంది మరియు అధికార పరిధి యొక్క ప్రదేశం న్యూ ఢిల్లీ అవుతుంది.,Any dispute arising from your use of the site and such use of the site will be subject to the laws of the country and the area of authority will be new to New Zealand.
20 December 2021,20 డిసెంబర్ 2021,20 December 2021
"Poshan Abhiyaan is India’s flagship programme to improve nutritional outcomes for children, adolescents, pregnant women and lactating mothers by leveraging technology, a targeted approach and convergence.","పోషణ్ అభియాన్ అనేది పిల్లలు, కౌమారులు, గర్భిణీ స్త్రీలు మరియు పాలిచ్చే తల్లుల కొరకు పోషకాహార ఫలితాలను మెరుగుపరచడం కొరకు టెక్నాలజీ, ఒక లక్ష్యిత అప్రోచ్ మరియు కన్వర్జెన్స్ ద్వారా పోషకాహార ఫలితాలను మెరుగుపరచడం కొరకు భారతదేశం యొక్క ఫ్లాగ్ షిప్ ప్రోగ్రామ్.","The country's flagship program for improving food performance for children, pregnant women and pregnant women and pregnant mothers by using technology, a targeted app and convergents to improve food performance."
"Poshan Tracker Portal or App is governed by Ministry of Woman and Child Development, Government of India, hereinafter referred to as “MWCD”, “our”, “us”, “we” which shall include a reference to other departments and divisions of the program/campaign. References to Poshan Tracker Portal or App in this policy include Poshan Tracker or any other Apps or portals that are integrated with Poshan Tracker through APIs / related sites, apps, communications and services (“Services”) hereinafter collectively referred to as “Poshan Tracker or System.”","పోషణ్ ట్రాకర్ పోర్టల్ లేదా యాప్ అనేది భారత ప్రభుత్వ మహిళా మరియు శిశు అభివృద్ధి మంత్రిత్వ శాఖ ద్వారా నిర్వహించబడుతుంది, ఇకపై దీనిని ""MWCD"", ""మా"", ""మనం"", ""మనం"" అని పిలుస్తారు, దీనిలో ప్రోగ్రామ్/క్యాంపెయిన్ యొక్క ఇతర డిపార్ట్ మెంట్ లు మరియు డివిజన్ ల రిఫరెన్స్ ఉంటుంది. ఈ పాలసీలో పోషణ్ ట్రాకర్ పోర్టల్ లేదా యాప్ యొక్క రిఫరెన్స్ ల్లో పోషణ్ ట్రాకర్ లేదా APIలు/సంబంధిత సైట్ లు, యాప్ లు, కమ్యూనికేషన్ లు మరియు సర్వీస్ లు (""సర్వీస్ లు"") ద్వారా పోషణ్ ట్రాకర్ తో ఇంటిగ్రేట్ చేయబడ్డ ఏదైనా ఇతర యాప్ లు లేదా పోర్టల్ లు చేర్చబడతాయి, ఇకపై సమిష్టిగా ''పోషణ్ ట్రాకర్ లేదా సిస్టమ్''గా రిఫర్ చేయబడతాయి.","Posting trucker Portal or Jap references are required by government women and children's development framework, and they call it ""MWCD"", ""MWCD"", ""we"", ""we"", ""we"" and include other parts of the program/campain and distributions. In this policy, the mail transporter portals or references to Japan's reference sites are also referred to as ""MWCD"", ""we"", ""we"", ""we"", ""we"" and ""we""."
"Our Privacy Policy applies when you use our Services (described below). This Privacy Policy is meant to help you understand what information we collect, why we collect it, and how it is used and shared. The collecting and retaining agency in respect of your information is MWCD.","మీరు మా సేవలను ఉపయోగించినప్పుడు మా గోప్యతా విధానం వర్తిస్తుంది (దిగువ వివరించబడింది). మేము ఏ సమాచారాన్ని సేకరిస్తాము, మేము దానిని ఎందుకు సేకరిస్తాము మరియు అది ఎలా ఉపయోగించబడుతుంది మరియు భాగస్వామ్యం చేయబడుతుందో అర్థం చేసుకోవడంలో మీకు సహాయపడటానికి ఈ గోప్యతా విధానం ఉద్దేశించబడింది. మీ సమాచారానికి సంబంధించి సేకరించే మరియు నిలుపుకునే ఏజెన్సీ MWCD.","When you use our services, our Privacy Policy (detailed below). We collect what information we collect for why we collect it and it is used and it is intended to help you understand how to share it."
"We are committed to protecting the security of your personal information and safeguarding your privacy. Any information or data collected and processed on the System is done in accordance with the provisions of Information Technology Act, 2000 read with its Rules and other national and state laws relating to the collection and processing of personal data.","మీ వ్యక్తిగత సమాచారం యొక్క భద్రతను సంరక్షించడానికి మరియు మీ గోప్యతను సంరక్షించడానికి మేం కట్టుబడి ఉన్నాం. సిస్టమ్ పై సేకరించబడ్డ మరియు ప్రాసెస్ చేయబడ్డ ఏదైనా సమాచారం లేదా డేటా ఇన్ఫర్మేషన్ టెక్నాలజీ యాక్ట్, 2000 యొక్క నిబంధనలకు అనుగుణంగా చేయబడుతుంది మరియు వ్యక్తిగత డేటా యొక్క సేకరణ మరియు ప్రాసెసింగ్ కు సంబంధించిన ఇతర జాతీయ మరియు రాష్ట్ర చట్టాలతో రీడ్ చేయబడుతుంది.",We are committed to protecting the security of your personal information and protecting your privacy. Any information collected and processed on the system or data information technology act will be done in accordance with the 2000 agreements and will be governed by other national and state laws relating to the collection and processing of personal data.
This Privacy Policy is required to be read in conjunction with the Terms of Service available at,ఈ గోప్యతా విధానాన్ని,This Privacy Policy
". Your access to and use of the System is conditional upon your acceptance of this Privacy Policy and the Terms of Service. By accessing and/or using the System, you represent that you have read, understood and are bound by the Terms of Service and this Privacy Policy, and that you consent to your information and data being collected, stored and used in the manner laid out in this Privacy Policy.","వద్ద లభ్యం అయ్యే సేవా నిబంధనలకు అనుబంధంగా చదవాల్సి ఉంటుంది. ఈ గోప్యతా విధానం మరియు సేవా నిబంధనలను మీరు ఆమోదించిన తరువాత సిస్టమ్ యొక్క మీ ప్రాప్యత మరియు ఉపయోగం షరతులతో కూడినది. సిస్టమ్ ని యాక్సెస్ చేసుకోవడం మరియు/లేదా ఉపయోగించడం ద్వారా, మీరు సేవా నిబంధనలు మరియు ఈ గోప్యతా విధానాన్ని చదివారని, అర్థం చేసుకున్నారని మరియు దానికి కట్టుబడి ఉన్నారని మరియు ఈ గోప్యతా విధానంలో పేర్కొనబడ్డ రీతిలో మీ సమాచారం మరియు డేటా సేకరించడానికి, నిల్వ చేయడానికి మరియు ఉపయోగించడానికి మీరు సమ్మతిస్తున్నారని మీరు ప్రాతినిధ్యం వహిస్తున్నారు.","You are required to read about service contracts that are available to you. After you have approved this Privacy and Service Agreements, your system's privacy and usage are linked to conditions. By accessing and/or using the system, you are able to read and understand service contracts and this Privacy Policy, and are bound to them, and you agree to collect your information and data in this Privacy Policy mode, to continue and use it."
