en,te,translated_helsinki
"Submit any software or other materials that contain any viruses, worms, Trojan horses, defects, date bombs, time bombs or other items of destructive nature","ఏదైనా వైరస్ లు, వార్మ్ లు, ట్రోజన్ హార్స్ లు, డిఫెక్ట్స్, డేట్ బాంబులు, టైమ్ బాంబ్ లు లేదా విధ్వంసక స్వభావం కలిగిన ఇతర ఐటమ్ లను కలిగి ఉన్న ఏదైనా సాఫ్ట్ వేర్ లేదా ఇతర మెటీరియల్స్ ని సబ్మిట్ చేయండి","Submit something that has any virus, warms, trojan hair, defects, date bombs, time bombs or other educational properties"
"Manipulate identifiers, including by forging headers, in order to disguise the origin of any posting that you submit","మీరు సబ్మిట్ చేసే ఏదైనా పోస్టింగ్ యొక్క మూలాన్ని మరుగుపరచడం కొరకు, హెడ్డర్ లను ఫోర్జరీ చేయడం ద్వారా ఐడెంటిఫైయర్ లను మ్యానిపులేట్ చేయండి","To hide the source of any posting you submit, manipulating header by forceing header"
Link to any portion of the Site other than the URL assigned to the home page of the Site,సైట్ యొక్క హోమ్ పేజీకి అసైన్ చేయబడ్డ URL కాకుండా సైట్ యొక్క ఏదైనా భాగానికి లింక్ చేయండి,"Link the website's home page to a section of the site, not the URL"
“Frame” or “Mirror” any part of the Site,"సైట్ యొక్క ఏదైనా భాగాన్ని ""ఫ్రేమ్"" లేదా ""మిర్రర్""","Some parts of the site are ""frame"" or ""mirror"""
"Modify, adapt, sub-license, translate, sell, reverse engineer, decompile or disassemble any portion of the Site, or otherwise attempt to derive any source code or underlying ideas or algorithms of any part of the Content","సైట్ యొక్క ఏదైనా భాగాన్ని సవరించడం, స్వీకరించడం, సబ్-లైసెన్స్, అనువదించడం, అమ్మడం, రివర్స్ ఇంజినీర్, డీకంపైల్ చేయడం లేదా విడదీయడం, లేదా కంటెంట్ యొక్క ఏదైనా భాగం యొక్క ఏదైనా సోర్స్ కోడ్ లేదా అంతర్లీన ఆలోచనలు లేదా అల్గారిథమ్ లను పొందడానికి ప్రయత్నించడం","Trying to fix, accept, sub-licence, translate, sell, River Engineer, decode or release any part of a site, or get any source code or internal ideas or algorithms of any part of a site"
"Remove any copyright, trademark or other proprietary rights notices contained on the Site","సైట్ లో ఉన్న ఏదైనా కాపీరైట్, ట్రేడ్ మార్క్ లేదా ఇతర యాజమాన్య హక్కుల నోటీసులను తొలగించండి","Remove any copyright, trademark or other copyright notes on the site"
"Use any computer program, bot, robot, spider, offline reader, site search/retrieval application or other manual or automatic device, tool, or process to retrieve, index, data mine, or in any way reproduce or circumvent the security structure, navigational structure, or presentation of the Content or the Site, including with respect to any CAPTCHA displayed on the Site.","ఏదైనా కంప్యూటర్ ప్రోగ్రామ్, బాట్, రోబోట్, స్పైడర్, ఆఫ్ లైన్ రీడర్, సైట్ సెర్చ్/రిట్రీవల్ అప్లికేషన్ లేదా ఇతర మాన్యువల్ లేదా ఆటోమేటిక్ పరికరం, టూల్ లేదా ప్రాసెస్ ని తిరిగి పొందడానికి, ఇండెక్స్ చేయడానికి, డేటా మైన్ కు, లేదా సైట్ లో ప్రదర్శించబడే ఏదైనా CAPTCHAకు సంబంధించి సహా, కంటెంట్ లేదా సైట్ యొక్క భద్రతా నిర్మాణం, నావిగేషనల్ స్ట్రక్చర్ లేదా ప్రజంటేషన్ ని పునరుత్పత్తి చేయడం లేదా దాటవేయడం కొరకు ఏదైనా కంప్యూటర్ ప్రోగ్రామ్ ఉపయోగించండి.","Use a computer program, such as a computer program, a boat, a robot, a Spider, an off-line reader, a site seeker/retrieval application or other manual or automatic device, a tool or process to retrieve, index, data to or use a computer program to build a site's security, or to rebuild or transfer a navigational structure or population."
Use any automated software or computer system to search for or book appointment including sending information from your computer to another computer where such software or system is active,మీ కంప్యూటర్ నుంచి అటువంటి సాఫ్ట్ వేర్ లేదా సిస్టమ్ యాక్టివ్ గా ఉన్న మరో కంప్యూటర్ కు సమాచారాన్ని పంపడంతో సహా అపాయింట్ మెంట్ కొరకు శోధించడానికి లేదా బుక్ చేయడానికి ఏదైనా ఆటోమేటెడ్ సాఫ్ట్ వేర్ లేదా కంప్యూటర్ సిస్టమ్ ఉపయోగించండి,"Use an automated software or a computer system to test or book information about another computer, including the software on your computer."
Take any action that imposes or may impose (in our sole discretion) an unreasonable or disproportionately large load on our infrastructure.,మా మౌలిక సదుపాయాలపై అసమంజసమైన లేదా అసమానంగా పెద్ద భారాన్ని విధించే లేదా విధించే ఏదైనా చర్యను (మా స్వంత విచక్షణ మేరకు) తీసుకోండి.,Take any action (for our own self - examination) that is unfair or unjust on our part.
"Use the Site or Reproduce, modify, display, publicly perform, distribute or create derivative works of the Site or the Content","సైట్ ఉపయోగించండి లేదా సైట్ లేదా కంటెంట్ యొక్క డెరివేటివ్ వర్క్ లను పునరుత్పత్తి చేయడం, సవరించడం, ప్రదర్శించడం, బహిరంగంగా నిర్వహించడం, పంపిణీ చేయడం లేదా సృష్టించడం","Reproduce, modify, display, manage, send or create remote works of site or county"
"The Content in an attempt to, or in conjunction with, any device, program or service designed to circumvent any technological measure that effectively controls access to, or the rights in, the Site and/or Content in any way including, without limitation, by manual Decode, decrypt, modify, or reverse engineer certificate or underlying algorithms or automatic device or process, for any purpose","మాన్యువల్ డీకోడ్, డీక్రిప్ట్, మాడిఫై, లేదా రివర్స్ ఇంజినీర్ సర్టిఫికేట్ లేదా అంతర్లీన అల్గోరిథమ్ లు లేదా స్వయంచాలక పరికరం లేదా ప్రాసెస్ ద్వారా పరిమితి లేకుండా, సైట్ మరియు/లేదా కంటెంట్ యొక్క ప్రాప్యతను సమర్థవంతంగా నియంత్రించే ఏదైనా సాంకేతిక కొలతను లేదా దానిలోని హక్కులను అధిగమించడానికి రూపొందించబడ్డ ఏదైనా పరికరం, ప్రోగ్రామ్ లేదా సేవతో పాటుగా రూపొందించబడ్డ ఏదైనా పరికరం, ప్రోగ్రామ్ లేదా సేవతో పాటుగా కంటెంట్, ఏ ప్రయోజనానికైనా","Any device that is designed to control the presence of a site and/or client successfully, or any device that is formed with a program or service, program or service, program or service, software or service without having limitations."
"You will not use bot technology to search for registering participants through the Site; for the avoidance of doubt, this specifically prohibits you from using automated script based or automated software on the Site, and prohibits you from circumventing any security measure, access control system, or other technological control or measure on the Site that is used to enforce participation limits or to maintain the integrity of registering participants rules associated with one mobile number","సైట్ ద్వారా పాల్గొనేవారిని రిజిస్టర్ చేసుకోవడం కొరకు శోధించడం కొరకు మీరు బాట్ టెక్నాలజీని ఉపయోగించరు; సందేహాన్ని పరిహరించడం కొరకు, సైట్ లో ఆటోమేటెడ్ స్క్రిప్ట్ ఆధారిత లేదా ఆటోమేటెడ్ సాఫ్ట్ వేర్ ఉపయోగించడాన్ని ఇది ప్రత్యేకంగా నిషేధిస్తుంది మరియు పాల్గొనే పరిమితులను అమలు చేయడానికి లేదా ఒక మొబైల్ నెంబరుకు సంబంధించిన పాల్గొనేవారి నియమాలను రిజిస్టర్ చేయడం యొక్క సమగ్రతను మెయింటైన్ చేయడానికి ఉపయోగించే ఏదైనా భద్రతా కొలత, యాక్సెస్ కంట్రోల్ సిస్టమ్, లేదా ఇతర సాంకేతిక నియంత్రణ లేదా కొలతలను సైట్ లో దాటవేయకుండా మిమ్మల్ని నిషేధిస్తుంది","You do not use the boot technology to try to register those who are logged through a site; it specifically forbids the use of automated scripts based on or automated software on the site to prevent any security exploits from registering the peer's rules on a mobile number, restricting access control system, or restricting other communication controls."
VII. INTELLECTUAL PROPERTY RIGHTS,VII. మేధో సంపత్తి హక్కులు,VII. The Rights of the Meadows
We own the intellectual property rights in the Site and Content. We may change the Content and features of the Site at any time.,సైట్ మరియు కంటెంట్ లో మేధో సంపత్తి హక్కులను మేం స్వంతం చేసుకున్నాం. మేము ఏ సమయంలోనైనా సైట్ యొక్క కంటెంట్ మరియు ఫీచర్లను మార్చవచ్చు.,We have self-defensed property rights in the site and the county. We can change the site's quota and fixtures at any time.
"The registered and unregistered trademarks, logos, and service marks displayed on the Site are owned by us or our licensors. You may not use our trademarks, logos, and service marks in any way without our prior written permission.","సైట్ పై ప్రదర్శించబడే రిజిస్టర్డ్ మరియు రిజిస్టర్ కాని ట్రేడ్ మార్క్ లు, లోగోలు మరియు సర్వీస్ మార్క్ లు మా లేదా మా లైసెన్సర్ ల స్వంతం. మా ముందస్తు రాతపూర్వక అనుమతి లేకుండా మీరు మా ట్రేడ్ మార్క్ లు, లోగోలు మరియు సర్వీస్ మార్క్ లను ఏవిధంగానూ ఉపయోగించరాదు.","The registered and non-registered trademarks on the site are our own or our licensee. You will not use our trademarks, logos and service brands without our prior authorization."
"Material featured on this website may be reproduced free of charge. However, no part of the Site and no Content may be copied, republished, reproduced, uploaded, posted, displayed publicly, encoded, translated, transmitted or distributed in any way to any other computer, server, Web site or other medium for publication in a derogatory manner or in a misleading context.","ఈ వెబ్ సైట్ లో ఫీచర్ చేయబడ్డ మెటీరియల్ ని ఉచితంగా పునరుత్పత్తి చేయవచ్చు. అయితే, సైట్ యొక్క ఏ భాగం మరియు ఏ కంటెంట్ కూడా కాపీ చేయబడదు, తిరిగి ప్రచురించబడదు, పునరుత్పత్తి చేయబడదు, అప్ లోడ్ చేయబడదు, పోస్ట్ చేయబడదు, బహిరంగంగా ప్రదర్శించబడదు, ఎన్ కోడ్ చేయబడదు, అనువదించబడదు, ప్రసారం చేయబడదు లేదా ఏదైనా ఇతర కంప్యూటర్, సర్వర్, వెబ్ సైట్ లేదా ప్రచురణ కొరకు ఏదైనా ఇతర మాధ్యమానికి అభ్యంతరకరమైన రీతిలో లేదా తప్పుదారి పట్టించే సందర్భంలో పంపిణీ చేయబడదు.","This site is free software; however, any part of the site and any content can not be copied, reprinted, downloaded, downloaded, sent and shown on its site; no encoding, encoding, translation, distribution, or anything else will be forced on or forced on any other machine."
"You may use information available on the Site, provided that you will (1) use such information only for your personal, non-commercial informational purpose and do not copy or post such information on any networked computer or broadcast it in any media, (2) not make any modifications to any such information and any additional representations or warranties relating to such documents and Content.","మీరు (1) అటువంటి సమాచారాన్ని మీ వ్యక్తిగత, వాణిజ్యేతర సమాచార ప్రయోజనం కొరకు మాత్రమే ఉపయోగిస్తారు మరియు అటువంటి సమాచారాన్ని ఏదైనా నెట్ వర్క్ చేయబడ్డ కంప్యూటర్ లో కాపీ లేదా పోస్ట్ చేయరు లేదా ఏదైనా మాధ్యమంలో ప్రసారం చేయరు, (2) అటువంటి సమాచారం మరియు అటువంటి డాక్యుమెంట్ లు మరియు కంటెంట్ కు సంబంధించిన ఏవైనా అదనపు ప్రాతినిధ్యాలు లేదా వారెంటీలకు ఎలాంటి మార్పులు చేయనట్లయితే, సైట్ లో లభ్యం అయ్యే సమాచారాన్ని మీరు ఉపయోగించవచ్చు.","You (1) use such information only for your personal and personal use and do not copy or post any of these information on your computer, or in any of the media, and (2) you can use the information available on this site if you would like to make any changes to any additional information or information on this site."
"Wherever the material is being published or issued to others, the source must be prominently acknowledged. However, the permission to reproduce this material shall not extend to any material which is identified as being copyright of a third party.","ఎక్కడైతే ఆ సమాచార౦ ప్రచురి౦చబడుతు౦దో, లేదా ఇతరులకు అ౦ది౦చబడుతు౦దో అక్కడ మూల౦ ప్రముఖ౦గా అ౦గీకరి౦చబడాలి. అయితే, ఈ మెటీరియల్ ని పునరుత్పత్తి చేయడానికి అనుమతి తృతీయపక్షం యొక్క కాపీరైట్ గా గుర్తించబడ్డ ఏదైనా మెటీరియల్ కు విస్తరించబడదు.","Where this information is published, it should be published, or distributed to others. However, there is no need for a license to reproduce this metal."
VIII. LIMITATIONS OF MULTI- LINGUAL INTERFACE,VIII. బహుభాషా ఇంటర్ ఫేస్ యొక్క పరిమితులు,VIII. Multilingual Interface Limits
"Translations on the Poshan Tracker Portal & App Chabot are done by third party translators. While the translations are done on a best effort basis, some of the parts may be incorrect. Certain files and other items on the website cannot be translated. In addition, on translation, some applications and/or services may not function as expected, due to language barriers. We are working constantly to rectify any errors, omissions, or ambiguities in the translations provided on this portal.","పోషణ్ ట్రాకర్ పోర్టల్ మరియు యాప్ చాబోట్ పై అనువాదాలు తృతీయపక్ష అనువాదకుల ద్వారా చేయబడతాయి. అనువాదాలు ఉత్తమ ప్రయత్న ప్రాతిపదికన చేయబడినప్పటికీ, కొన్ని భాగాలు తప్పుగా ఉండవచ్చు. వెబ్ సైట్ లోని నిర్దిష్ట ఫైళ్లు మరియు ఇతర అంశాలను అనువదించడం సాధ్యం కాదు. దీనికి అదనంగా, అనువాదంపై, భాషా అడ్డంకుల కారణంగా, కొన్ని అప్లికేషన్ లు మరియు/లేదా సర్వీసులు ఆశించిన విధంగా పనిచేయకపోవచ్చు. ఈ పోర్టల్ పై ఇవ్వబడ్డ అనువాదాల్లో ఏవైనా దోషాలు, మినహాయింపులు లేదా అస్పష్టతలను సరిదిద్దడం కొరకు మేం నిరంతరం పనిచేస్తున్నాం.","Translations on the postal transporter portal and on the Jap Chabot will be done by translators. Although translations are generally best tried, some parts may be wrong. It is not possible to translate certain files and other components on the web site. In addition, some applications and/or services may not work as expected by language barriers. In any case, there are errors, translations or failures on this site."
IX. LINKS,IX. లింక్ లు,IX. Link
"The Site may contain links to other websites that may not be owned, maintained, or operated by us. The fact that these websites are linked, does not indicate any endorsement of these websites from us, since we do have any control over these websites. We are not responsible for these websites including any content or the privacy practices of these websites. We strongly encourage you to familiarize yourself with the terms of use of these websites. Your use of these websites is at your own risk and peril. It is solely up to you to take necessary precautions to ensure that the links you select or any software you may download is free of viruses, worms, Trojan horses, defects, date bombs, time bombs, and other or other computer programming routines which are of destructive nature","సైట్ మా ద్వారా స్వంతం చేసుకోబడని, నిర్వహించబడని లేదా ఆపరేట్ చేయబడని ఇతర వెబ్ సైట్ లకు లింక్ లను కలిగి ఉండవచ్చు. ఈ వెబ్ సైట్ లు లింక్ చేయబడ్డాయనే వాస్తవం, మా నుంచి ఈ వెబ్ సైట్ ల యొక్క ఎలాంటి ఎండార్స్ మెంట్ ని సూచించదు, ఎందుకంటే ఈ వెబ్ సైట్ లపై మాకు ఎలాంటి నియంత్రణ ఉంది. ఏదైనా కంటెంట్ లేదా ఈ వెబ్ సైట్ ల యొక్క గోప్యతా విధానాలతో సహా ఈ వెబ్ సైట్ లకు మేం బాధ్యత వహించం. ఈ వెబ్ సైట్ ల యొక్క ఉపయోగ నిబంధనలతో మిమ్మల్ని మీరు పరిచయం చేసుకోవాలని మేం మిమ్మల్ని బలంగా ప్రోత్సహిస్తున్నాం. ఈ వెబ్ సైట్ ల యొక్క మీ ఉపయోగం మీ స్వంత రిస్క్ మరియు ఆపదలో ఉంది. మీరు ఎంచుకున్న లింక్ లు లేదా మీరు డౌన్ లోడ్ చేసుకోగల ఏదైనా సాఫ్ట్ వేర్ లు వైరస్ లు, వార్మ్ లు, ట్రోజన్ హార్స్ లు, లోపాలు, తేదీ బాంబులు, టైమ్ బాంబ్ లు మరియు విధ్వంసక స్వభావం కలిగిన ఇతర లేదా ఇతర కంప్యూటర్ ప్రోగ్రామింగ్ రొటీన్ లు లేకుండా ఉండేలా ధృవీకరించుకోవడం కొరకు అవసరమైన జాగ్రత్తలు తీసుకోవడం అనేది మీపై మాత్రమే ఆధారపడి ఉంటుంది","The site may have links to other websites that are not self-contained, handled or operated by us. The fact that these websites are linked to us does not indicate any belonging to this site, because we have no control over this site. Some content or content of this site is subject to specific types of property, property, etc. We are responsible for all aspects of this site, including the properties of the property, properties and properties of the property, and properties of these websites. The use of these sites makes it possible for you to identify the properties of these sites and the properties of these sites."
X. ACCESS FROM OUTSIDE INDIA,X. భారతదేశం వెలుపల నుంచి యాక్సెస్,X. Extraordinary access from outside of country
