en,te,translated_helsinki
ABHA (Health ID),ABHA (హెల్త్ ఐడి),ABHA (Helth ID)
Language,భాష,Language
About,గురించి,About
Resources,వనరులు,Sources
Vaccination Schedule,వ్యాక్సినేషన్ షెడ్యూల్,Extension Scheduled
Dashboard,డాష్బోర్డ్,Dashboard
Helpdesk,హెల్ప్ డెస్క్,Help Desktop
Beneficiary Redressal,లబ్ధిదారుని పరిహారము,Synchronising folder
State Helpdesk,స్టేట్ హెల్ప్ డెస్క్,State Help Desktop
FAQ,తరచూ అడిగే ప్రశ్నలు,Questions From Readers
Poshan Calculator,పోషణ్ కాలిక్యులేటర్,Cannot initialise Evolution's mail component.
Login,లాగిన్,Login
Anganwadi Workers,అంగన్ వాడీ కార్యకర్తలు,Angon Woody Operators
Download Mobile App from Play Store,ప్లే స్టోర్ నుంచి మొబైల్ యాప్ డౌన్ లోడ్ చేసుకోండి,Download mobile app from game history
Scan the QR Code to Download the App,యాప్ డౌన్ లోడ్ చేసుకోవడం కొరకు QR కోడ్ స్కాన్ చేయండి,QR code scan for upload to Japan
What’s New on Poshan Tracker,పోషణ్ ట్రాకర్ లో కొత్తగా ఏమిటి,What's new in the mailbox tracker
Poshan Tracker adds new application features,పోషన్ ట్రాకర్ కొత్త అప్లికేషన్ ఫీచర్‌లను జోడిస్తుంది,Adds a new track track to the application
Poshan Tracker adds new Reports feature,పోషన్ ట్రాకర్ కొత్త రిపోర్ట్స్ ఫీచర్‌ని జోడిస్తుంది,Cannot initialise Evolution's mail component.
Poshan Tracker adds new Resources on Website,పోషన్ ట్రాకర్ వెబ్‌సైట్ ఫీచర్‌లో కొత్త వనరులను జోడిస్తుంది,Merges new sources into the Poster web browser
Resources for growth monitoring and general awareness,వృద్ధి పర్యవేక్షణ మరియు సాధారణ అవగాహన కోసం వనరులు,Sources for Advanced Monitoring and General Understanding
Growth monitoring charts,వృద్ధి పర్యవేక్షణ పటాలు,Advanced Modes of Watching the World
New beneficiary addition with skip OTP option,స్కిప్ OTP ఎంపికతో కొత్త లబ్ధిదారుని జోడింపు,Paste the new source file with the skip OTP selection
Mobile number need to be validated within a week,మొబైల్ నంబర్‌ను వారంలోపు ధృవీకరించాలి,Could not close temporary folder: %s
Anganwadi Worker profile page,అంగన్‌వాడీ కార్యకర్త ప్రొఫైల్ పేజీ,Angwadi profile manager page
Stunting and Underweight Growth Parameters,ఎదుగుదల లేకపోవడం మరియు తక్కువ బరువు ఎదుగుదల పారామితులు,Dithering and low weight increase parameters
Beneficiaries status change notifications,లబ్ధిదారుల స్థితి మార్పు నోటిఫికేషన్‌లు,Could not close temporary folder: %s
Migrated from one category to another,ఒక వర్గం నుండి మరొక వర్గానికి మారి వచ్చారు,From one class to another
Beneficiary record becoming inactive,లబ్ధిదారుని రికార్డు నిష్క్రియంగా మారుతోంది,The master's account is being turned off
Beneficiary migration from one AWC to another AWC,ఒక AWC నుండి మరొక AWCకి లబ్ధిదారుని మార్పు,Convert AWC from one AWC to another AWC
Beneficiary deletion by AWW,AWW ద్వారా లబ్ధిదారుని తొలగింపు,Remove sender via AWW
Default language selection,డిఫాల్ట్ భాష ఎంపిక,Could not close temporary folder: %s
"Beneficiary concerns accessibility to AWW, along with status update once resolved","లబ్దిదారుని ఆందోళనలు AWWకి ప్రాప్యత, ఒకసారి పరిష్కరించబడిన స్థితి నవీకరణతో పాటు",AWW’s anxieties include access to and status updates that have been resolved at the same time
Growth monitoring report for all health indicators,అన్ని ఆరోగ్య సూచికల కోసం వృద్ధి పర్యవేక్షణ నివేదిక,Progress report for all health signs
Application downloaded status by AWW,AWW ద్వారా అప్లికేషన్ డౌన్‌లోడ్ చేయబడిన స్థితి,The status of the application being downloaded by AWW
Beneficiary count report : Number of records becoming inactive and number of records migrating from one category to another,లబ్ధిదారుని గణన నివేదిక : నిష్క్రియంగా మారుతున్న రికార్డ్‌ల సంఖ్య మరియు ఒక కేటగిరీ నుండి మరో కేటగిరీకి మారుతున్న రికార్డ్‌ల సంఖ్య,Capitalize report: The number of cards that are turned off and the number of cards that are transferred from one category to another category
Poshan Calculator is designed to measure growth of the child based on standards defined by World Health Organization (WHO).,ప్రపంచ ఆరోగ్య సంస్థ (WHO) ద్వారా నిర్వచించబడ్డ ప్రమాణాల ఆధారంగా బిడ్డ ఎదుగుదలను లెక్కించడం కొరకు పోషణ్ కాలిక్యులేటర్ తాయారు చేసారు.,The World Health Organization (WHO) has set up a postgraduate calculus to calculate child growth according to standards.
How to use Poshan Calculator?,పోషణ కాలిక్యులేటర్ ను ఎలా ఉపయోగించాలి?,How to use the feed calculator?
Select Gender,లింగాన్ని ఎంచుకోండి,Could not close temporary folder: %s
Enter Date of Birth,పుట్టిన తేదీని నమోదు చేయండి,_Other Organiser
Enter Height in centimeter,ఎత్తును సెంటీమీటర్ లో ఎంటర్ చేయండి,Insert at the top of the centimeter
Enter Weight in kilogram,బరువును కిలోగ్రామ్ లో నమోదు చేయండి,Enter the weight in kilograms
Click on Show Results,షో రిజల్ట్స్ మీద క్లిక్ చేయండి,Click on Show Rules
Gender,లింగం,Link
Boy,అబ్బాయి,Boy.
Girl,అమ్మాయి,Girl
Date of Birth,పుట్టిన తేది,_Other Organiser
Height (CM),ఎత్తు (సెంమీ),High (Semi)
*Height should be between 38 to 150,*ఎత్తు 38 నుండి 150 మధ్య ఉండాలి,* The height should be between 38 and 150
CM,సెంమీ,Sammy
Weight (KG),బరువు (కిగ్రా),Weight (kigrams)
*Weight should be between 0.90 to 58,*బరువు 0.90 నుండి 58 మధ్య ఉండాలి,*Birth must be between 0.90 and 58
KG,కిగ్రా,KINDNESS
Show Results,ఫలితాలను చూపు,Show results
ABHA (Health ID) and its Benefits,ABHA (హెల్త్ ఐడి) మరియు దాని యొక్క ప్రయోజనాలు,ABHA (Helth ID) and its benefits
ABHA (earlier known as Health ID) is an acronym for Ayushman Bharat Health Account.,ABHA (ఇంతకు ముందు హెల్త్ ఐడి అని పిలువబడేది) అనేది ఆయుష్మాన్ భారత్ హెల్త్ అకౌంట్ యొక్క సంక్షిప్త పదం.,ABHA (formerly called Helth AIDS) is the short word of the Auishman fortress Helth Account.
Using ABHA (Health ID) is the first step towards creating safer and efficient digital health records for you and your family.,ABHA (హెల్త్ ఐడి) ఉపయోగించడం అనేది మీకు మరియు మీ కుటుంబానికి సురక్షితమైన మరియు సమర్థవంతమైన డిజిటల్ ఆరోగ్య రికార్డులను సృష్టించే దిశగా మొదటి దశ.,Using ABHA (Helth AIDS) is the first decade to create safe and effective digital health records for you and your family.
"It enables your interaction with participating healthcare providers, and allows you to receive your digital lab reports, prescriptions and diagnosis seamlessly from verified healthcare professionals and health service providers.","ఇది ఆరోగ్య సంరక్షణ ప్రదాతలతో మీ పరస్పర చర్యకు వీలు కల్పిస్తుంది, మరియు ధృవీకరించబడిన ఆరోగ్య సంరక్షణ నిపుణులు మరియు ఆరోగ్య సేవా ప్రదాతల నుండి మీ డిజిటల్ ల్యాబ్ రిపోర్టులు, ప్రిస్క్రిప్షన్లు మరియు రోగనిర్ధారణను నిరంతరాయంగా అందుకోవడానికి మిమ్మల్ని అనుమతిస్తుంది.","This will enhance your interaction with health care providers and allow you to receive your digital lab reports, transcripts and medical evidence from certified health care providers."
Know More,మరిన్ని తెలుసుకోండి,Learn More
×,×,x
Frequently Asked Questions,తరచుగా అడిగే ప్రశ్నలు,Questions From Readers
ALL,అందరు,All
BENEFICIARY REGISTRATION,లబ్ధిదారుడి రిజిస్ట్రేషన్,_Other Organiser
Take Home Ration,టేక్ హోమ్ రేషన్,Tic Home Reaction
Hot Cooked Meal,హాట్ కూకేడ్ మిల్,Hat Code Mail
What is Poshan Abhiyaan?,పోషన్ అభియాన్ అంటే ఏమిటి?,What's Posun Abion?
"Poshan Abhiyaan is India’s flagship programme to improve nutritional outcomes for children, adolescents, pregnant women and lactating mothers by leveraging technology, a targeted approach and convergence.","సాంకేతిక పరిజ్ఞానం, లక్ష్యంగా ఉన్న విధానం మరియు కలయిక ద్వారా పిల్లలు, కౌమారదశలు, గర్భిణీ స్త్రీలు మరియు పాలిచ్చే తల్లులకు పోషక ఫలితాలను మెరుగుపరిచేందుకు భారతదేశం యొక్క ప్రధాన కార్యక్రమం పోషన్ అభియాన్.","The country's main program for improving food performance for children, pregnant women and pregnant women and pregnant mothers by means of physical knowledge, targeted method and practice."
What is the purpose of Launching Poshan Tracker?,పోషన్ ట్రాకర్‌ను ప్రారంభించడం యొక్క ఉద్దేశ్యం ఏమిటి?,What is the purpose of starting a mail transporter?
"The purpose of POSHAN Tracker application is to provide a 360-degree view of the activities of the Anganwadi Centre (AWC), service deliveries of Anganwadi Workers (AWWs) and complete beneficiary management for pregnant women, lactating mothers and children. The proposed system should enable real-time monitoring and tracking of all AWCs, AWWs and beneficiaries on the defined indicators.","పోషన్ ట్రాకర్ అప్లికేషన్ యొక్క ఉద్దేశ్యం అంగన్వాడీ సెంటర్ (ఎడబ్ల్యుసి), అంగన్వాడీ వర్కర్స్ (ఎడబ్ల్యుడబ్ల్యు) యొక్క సర్వీస్ డెలివరీలు మరియు గర్భిణీ స్త్రీలు, పాలిచ్చే తల్లులు మరియు పిల్లలకు పూర్తి లబ్ధిదారుల నిర్వహణ గురించి 360 డిగ్రీల వీక్షణను అందించడం. ప్రతిపాదిత వ్యవస్థ నిర్వచించిన సూచికలపై అన్ని (ఎడబ్ల్యుసి), (ఎడబ్ల్యుడబ్ల్యు) మరియు లబ్ధిదారుల యొక్క రియల్ -టైమ్ పర్యవేక్షణ మరియు ట్రాకింగ్‌ను ప్రారంభించాలి.","The purpose of the post-tracker application is to provide 360 degrees view of the management of the services of Anguady Center (Edblus), Anguady Works (EdBL) and the services of women and pregnant women, mothers and children. All (ADBBBB), and the real-time monitoring and tracking of drivers should be started on the instructions provided by the appropriate system."
How can one Download Poshan Tracker App?,పోషన్ ట్రాకర్ యాప్ ని ఎలా డౌన్‌లోడ్ చేసుకోవచ్చు?,How can you download the mailbox tracker app?
Poshan Tracker App is available over Google playstore,పోషాన్ ట్రాకర్ అనువర్తనం గూగుల్ ప్లేస్టోర్ ద్వారా అందుబాటులో ఉంది,The application Pashon Tracker is available by Google Player
Is poshan trackers app available over Apple I Store also?,ఆపిల్ ఐ స్టోర్ ద్వారా పోషన్ ట్రాక్ యాప్ అందుబాటులో ఉందా?,Is it available via Apple I Store?
"No, Poshan Tracker is available only for Android version",ఆండ్రాయిడ్ వెర్షన్ కోసం మాత్రమే పోషన్ ట్రాకర్ అందుబాటులో ఉంది.,Android version is only available for post-tracker.
What is the minimum requirement to install Poshan Tracker App in mobile?,మొబైల్‌లో పోషన్ ట్రాకర్ యాప్‌ను ఇన్‌స్టాల్ చేయడానికి కనీస అవసరం ఏమిటి?,What is needed in order to install a mobile mail transporter?
Poshan Tracker App can only be installed in Android Phone with Android version 6.0 and above.,పోషన్ ట్రాకర్ యాప్‌ను ఆండ్రాయిడ్ ఫోన్‌లో ఆండ్రాయిడ్ వెర్షన్ 6.0 మరియు అంతకంటే ఎక్కువ ఉంటే ఇన్‌స్టాల్ చేయవచ్చు.,You can install the Android version 6.0 and more if you have more than one.
View All FAQs,అన్ని తరచుగా అడిగే ప్రశ్నలను వీక్షించండి,"See the Questions Young People Ask — Answers That Work, Volume 2, published by the Watchtower Bible and Tract Society of New York, Inc."
Can a beneficiary register directly using application.,లబ్ధిదారుడు అప్లికేషన్ ఉపయోగించి నేరుగా రిజిస్టర్ చేసుకోవచ్చా.,Whether the main application should be able to register directly.
Currently a beneficiary can register by the help of an AWW,ప్రస్తుతం ఒక లబ్ధిదారుడు AWW యొక్క సాయంతో రిజిస్టర్ చేసుకోవచ్చు,AWW can now be registered by an agent at the time of AWW
Who is a beneficiary?,లబ్ధిదారుడు ఎవరు?,Who Is the Master of the harvest?
There are 6 categories for beneficiaries,లబ్ధిదారుల కొరకు 6 కేటగిరీలు ఉన్నాయి,There are 6 categories for drivers
Pregnant Women,గర్భిణీ స్త్రీలు,BABYLONIAN WOMANS
Lactating Mother,పాలిచ్చే తల్లి,A Mother Who Died
Children from 0 to 6 months,0 నుంచి 6 నెలల పిల్లలు,Children from 0 to 6 months of age
Children from 6 months to 3 years,6 నెలల నుంచి 3 సంవత్సరాల పిల్లలు,From 6 months to 3 years of age
Children from 3 years to 6 years,3 సంవత్సరాల నుండి 6 సంవత్సరాల వరకు పిల్లలు,Children 3 From 3 to 6
Adolescent girls,కౌమార బాలికలు,Children’s Picture Search
Can a beneficiary change his/her AWC?,లబ్ధిదారుడు అతడి/ఆమె AWC ని మార్చవచ్చా?,Could the master change him/her AWC?
An AWW can use ‘Migrate Beneficiary’ option to migrate a beneficiary from one AWC to another AWC basis their Aadhaar number.,ఒక AWC నుంచి మరో AWCకి వారి ఆధార్ నెంబరు ఆధారంగా లబ్ధిదారుడిని మైగ్రేట్ చేయడం కొరకు 'మైగ్రేట్ బెనిఫిషియరీ' ఆప్షన్ ని AWW ఉపయోగించుకోవచ్చు.,"From one AWC to another AWC, the 'Migrate Beneficiary' option can be used to migrate their base number to another AWC."
What is the eligibility of a beneficiary?,లబ్ధిదారుని యొక్క అర్హత ఏమిటి?,What is the role of the commander?
A beneficiary is eligible for THR for at least 21 days in a month.,లబ్ధిదారుడు నెలలో కనీసం 21 రోజులపాటు THR పొందడానికి అర్హులు.,At least 21 days a month is worth getting THR.
Who is eligible for Take Home Ration?,టేక్ హోమ్ రేషన్ కు ఎవరు అర్హులు?,Who's entitled to the Teck Home Reaction?
"Pregnant Women, Lactating Mothers, Children from 6 months to 3 years and adolescent girls.","గర్భిణీ స్త్రీలు, పాలిచ్చే తల్లులు, 6 నెలల నుండి 3 సంవత్సరాల వరకు పిల్లలు మరియు కౌమార బాలికలు.","Pregnant women, pregnant mothers, children from 6 months to 3 years of age and pregnant children."
Where can I enquire about take home ration?,టేక్ హోమ్ రేషన్ గురించి నేను ఎక్కడ విచారించగలను?,Where can I ask about the Teck Home Reaction?
Please contact your respective Anganwadi worker.,దయచేసి మీ సంబంధిత అంగన్ వాడీ వర్కర్ ని సంప్రదించండి.,Please contact the Angwady Worker for your related work.
Who is eligible for additional supplementary food.,అదనపు అనుబంధ ఆహారానికి ఎవరు అర్హులు.,Who is worthy of more than one loaf of bread?
Children who are identified as deficit on nutrition are eligible for additional food supplements.,పోషకాహార లోపంగా గుర్తించిన పిల్లలు అదనపు ఆహార అనుబంధాలకు అర్హులు.,Children who are well - known for their diet are entitled to more food.
A beneficiary is eligible for HCM for at least 21 days in a month.,లబ్ధిదారుడు నెలలో కనీసం 21 రోజులపాటు HCMకు అర్హత కలిగి ఉంటాడు.,"For at least 21 days a month, the master is entitled to HCM."
Who is eligible for Hot Cooked Meal?,హాట్ కూకేడ్ మిల్ ఎవరు అర్హులు?,Who are the hot code miles?
Children in the age group of 3 years to 6 years,3 సంవత్సరాల నుంచి 6 సంవత్సరాల వయస్సు గల పిల్లలు,Children aged 3 to 6
Where can I enquire about Hot Cooked Meal?,హాట్ కూకేడ్ మిల్ గురించి నేను ఎక్కడ విచారించగలను?,Where can I ask about hot code miles?
Please contact your respective Anganwadi Centre.,దయచేసి మీ సంబంధిత అంగన్ వాడీ కేంద్రాన్ని సంప్రదించండి.,Please contact your related Angwadi Unit.
Who is eligible for additional supplementary food?,అదనపు అనుబంధ ఆహారానికి ఎవరు అర్హులు?,Who Is Qualified to Partake?
We are now available on Video Conference,మేము ఇప్పుడు వీడియో కాన్ఫరెన్స్ లో అందుబాటులో ఉన్నాము,We are now available at video conferences
State Video Conference,రాష్ట్ర వీడియో కాన్ఫరెన్స్,National Video Conferences
Monday to Friday,సోమవారం నుండి శుక్రవారం వరకు,From Monday to Friday
Join Now,ఇప్పుడు చేరండి,Come on in now
Anganwadi Worker Training,అంగన్‌వాడీ కార్యకర్త శిక్షణ,Angawadi Manager Training
Support,సహాయంగా,Help
support-poshantrackr@gov.in,support-poshantrackr@gov.in,support-posthantrackr@gov.in
Download Mobile App,మొబైల్ యాప్ డౌన్ లోడ్ చేసుకోండి,Download Mobile Apps
Terms of Service,సేవా నిబంధనలు,Could not close temporary folder: %s
Privacy Policy,గోప్యతా విధానం,Privacy Policy
Careers,కెరీర్ లు,Kerryla
About Poshan Tracker,పోషణ్ ట్రాకర్ గురించి,About Cannot initialise Evolution's mail component.
Poshan Tracker App,పోషణ్ ట్రాకర్ యాప్,Cannot initialise Evolution's mail component.
"The ‘Poshan Tracker’ is a mobile based application rolled out by the Ministry of Women and Child Development, Government of India on 1st March 2021 through National e-Governance Division (NeGD), Poshan Tracker is an important governance tool. Technology under Poshan Tracker is being leveraged for dynamic identification of stunting, wasting, under-weight prevalence among children and last mile tracking of nutrition service delivery.","'పోషణ్ ట్రాకర్' అనేది ఒక మొబైల్ ఆధారిత అప్లికేషన్, ఇది భారత ప్రభుత్వ మహిళా మరియు శిశు అభివృద్ధి మంత్రిత్వ శాఖ, నేషనల్ ఇ-గవర్నెన్స్ డివిజన్ (ఎన్ఇజిడి), మైగోవ్ ద్వారా 2021 మార్చి 1 న ఒక ముఖ్యమైన పరిపాలనా సాధనంగా విడుదల చేసింది. పోషణ్ ట్రాకర్ కింద సాంకేతిక పరిజ్ఞానం పిల్లలలో ఎదుగుదల, వృధా, తక్కువ బరువు ప్రాబల్యం యొక్క సరైన గుర్తింపు మరియు న్యూట్రిషన్ సర్వీస్ డెలివరీ యొక్క లాస్ట్ మైల్ ట్రాకింగ్ కొరకు పరపతి చేయబడుతోంది.","A mobile-based application, it's a mandatory government woman and child development agency, the National In-Governments Division (NJD), released as a major government tool on March 1, 2021 by Maygov."
